comment_id_hash,comment_id,post_id_hash,post_url,post_shortcode,source_account,comment_text,comment_created_at,scraped_at,queue_id,scraping_status,is_baseline
c046e3adce2476d24e35b88f52e3141b607f629b4dbebe5aa2cb222b0cc93b05,18099787856145005,ea38d8e2d4587c60650042591bf83214e0a0317c318f489fd0ab5d02624a54fe,https://www.instagram.com/p/DY2NiYRvphs/,DY2NiYRvphs,@ericahyadi_,Mau dong kak satenya :) @megaelizaaa,2026-05-28T13:54:29.000Z,2026-06-06T05:09:45Z,Q_319e1f46d097,new,true
18123edecf935b342bd89bd1e9d48ebfb917477b308f346331d334edc32f2011,18105640495785235,ea38d8e2d4587c60650042591bf83214e0a0317c318f489fd0ab5d02624a54fe,https://www.instagram.com/p/DY2NiYRvphs/,DY2NiYRvphs,@ericahyadi_,parkir liarmu wes mbok urus ta?,2026-05-28T12:43:06.000Z,2026-06-06T05:09:45Z,Q_319e1f46d097,new,true
a04c1350a3e6aea4da599d17f8e461ae86c0600ba19bbc2138fa6ec5459800c7,18093898736462569,ea38d8e2d4587c60650042591bf83214e0a0317c318f489fd0ab5d02624a54fe,https://www.instagram.com/p/DY2NiYRvphs/,DY2NiYRvphs,@ericahyadi_,"Tak dekek kulkas, sikile Karo buntute digantung, engkok apene tak resik i pak Erik. 😂😂",2026-05-27T20:07:23.000Z,2026-06-06T05:09:45Z,Q_319e1f46d097,new,true
6d3af972723849d5fc9c126a431f59777ac7c4f0224d68e23a3ab8b9de2ca6cd,18530455789079147,ea38d8e2d4587c60650042591bf83214e0a0317c318f489fd0ab5d02624a54fe,https://www.instagram.com/p/DY2NiYRvphs/,DY2NiYRvphs,@ericahyadi_,Selamat ulang tahun pak Wali @ericahyadi_ semoga sehat selalu berkah selalu di umur yang bertambah 😇bahagia dan kedamaian selalu menyertai keluarga besar🙏,2026-05-27T15:59:42.000Z,2026-06-06T05:09:45Z,Q_319e1f46d097,new,true
c19fbcb20564e15118c821be5811e409788c9cf9588413f110f40604fda41a7f,18101656096940928,ea38d8e2d4587c60650042591bf83214e0a0317c318f489fd0ab5d02624a54fe,https://www.instagram.com/p/DY2NiYRvphs/,DY2NiYRvphs,@ericahyadi_,❤️❤️❤️❤️❤️,2026-05-27T15:40:38.000Z,2026-06-06T05:09:45Z,Q_319e1f46d097,new,true
9471531610842347412eb487a006c1b36b60d18f5e63c9761a8e9aebc4812466,18029867477805632,a6e6ff165edb43af14c65d94a9b0f986e097e6ded5770ad0bf8f5f1555999cd3,https://www.instagram.com/p/DYy78rDvRNp/,DYy78rDvRNp,@ericahyadi_,😍😍😍😍😍,2026-06-01T01:08:18.000Z,2026-06-06T05:09:56Z,Q_dbfc5d8a7527,new,true
4d1a9f66115eeec1d471779962e46a971c16087cd98af0b1392499dc83322fb2,18065484161456407,a6e6ff165edb43af14c65d94a9b0f986e097e6ded5770ad0bf8f5f1555999cd3,https://www.instagram.com/p/DYy78rDvRNp/,DYy78rDvRNp,@ericahyadi_,"nyuwun tolong pak ojok ngurusi parkir mawon.. suroboyo marak begal maneh iki.. keselamatan e wong luwih penting timbang digitalisasi.. Jukir² ndablek gak onok maneh neg gak golongan e wong mexico,, tukang rusuh nang suroboyo ae iku..",2026-05-30T06:40:12.000Z,2026-06-06T05:09:56Z,Q_dbfc5d8a7527,new,true
a4cabb4b2a693a96ae4d0fcfd9615e11dde9996fa7a173f3f2f2cbec2eb6ad83,17940033864227262,a6e6ff165edb43af14c65d94a9b0f986e097e6ded5770ad0bf8f5f1555999cd3,https://www.instagram.com/p/DYy78rDvRNp/,DYy78rDvRNp,@ericahyadi_,https://www.youtube.com/live/vsNGdcZSTj0?si=cP_w92Z1MacBRxVf,2026-05-30T06:38:05.000Z,2026-06-06T05:09:56Z,Q_dbfc5d8a7527,new,true
953fe2954b9ba3ee98393112a9525c8b192dfbda9a0ad1aa265f748629c3b9ce,17891476068493667,a6e6ff165edb43af14c65d94a9b0f986e097e6ded5770ad0bf8f5f1555999cd3,https://www.instagram.com/p/DYy78rDvRNp/,DYy78rDvRNp,@ericahyadi_,🔥🔥🔥,2026-05-28T06:18:50.000Z,2026-06-06T05:09:56Z,Q_dbfc5d8a7527,new,true
2e090118a7e18427bb3c4a8c0345ff8d997c9a174998643b1f6fd3c4f577cbef,18117733405691930,a6e6ff165edb43af14c65d94a9b0f986e097e6ded5770ad0bf8f5f1555999cd3,https://www.instagram.com/p/DYy78rDvRNp/,DYy78rDvRNp,@ericahyadi_,"PAK, BANYAK SEKALI YANG BAKAR-BAKAR DI JAM TIDUR TERUTAMA MALAM HARI DEKAT PEMUKIMAN. TOLONG ADA TINDAKAN TEGAS 🙏",2026-05-27T17:06:58.000Z,2026-06-06T05:09:56Z,Q_dbfc5d8a7527,new,true
70bf2382fc48ff25c78364eee81393ca6da818ff47eb490c279020b38c823588,17993812751986844,a6e6ff165edb43af14c65d94a9b0f986e097e6ded5770ad0bf8f5f1555999cd3,https://www.instagram.com/p/DYy78rDvRNp/,DYy78rDvRNp,@ericahyadi_,"ngurusi parkir gak mari2, dalanmu iku benekno membahayakan",2026-05-27T09:05:10.000Z,2026-06-06T05:09:56Z,Q_dbfc5d8a7527,new,true
6b3a0c46cd5b271f13e59c489379ff1fec729174f6444ba4c5fcf3513624724a,17950339329167470,a6e6ff165edb43af14c65d94a9b0f986e097e6ded5770ad0bf8f5f1555999cd3,https://www.instagram.com/p/DYy78rDvRNp/,DYy78rDvRNp,@ericahyadi_,Wani bubarin pjs po ora riii... Mbelll,2026-05-27T04:40:44.000Z,2026-06-06T05:09:56Z,Q_dbfc5d8a7527,new,true
11b71feaac642a07a5589e6a8327e65a6a1bd009f7fc38143637acedee448c03,18327709663266656,a6e6ff165edb43af14c65d94a9b0f986e097e6ded5770ad0bf8f5f1555999cd3,https://www.instagram.com/p/DYy78rDvRNp/,DYy78rDvRNp,@ericahyadi_,😮,2026-05-27T01:15:37.000Z,2026-06-06T05:09:56Z,Q_dbfc5d8a7527,new,true
f102bc0a6262a118546e5ab3bcf15006eba96100d6fe46202a9f216abef300ab,18590454559048087,a6e6ff165edb43af14c65d94a9b0f986e097e6ded5770ad0bf8f5f1555999cd3,https://www.instagram.com/p/DYy78rDvRNp/,DYy78rDvRNp,@ericahyadi_,"Lapor Cak Eri. Isuk iki aku sembahyang Idul Adha nang Masjid Agung Peneleh. Aku mlaku liwat Jembatan Peneleh. Sisi kanan kiri jembatan iki onok KAYU sing digawe mlaku pejalan kaki. Kayune iki onok sing Krowok, Rusak. Mumpung durung onok warga sing dadi korban kejeglong nyuwun tulung Kayu Kayune di perbaiki supoyo kuwat. Terus pot sing sak Gajah gajah iku ojok di tempatno nang dukure kayu. Jelas cepet jebol kayune.Nyuwun tulung yo Cak Eri. Mugo mugo Hajine Mabrur yo Cak. Nedon Rimo Cak🙏",2026-05-27T00:52:34.000Z,2026-06-06T05:09:56Z,Q_dbfc5d8a7527,new,true
16baecb09e7046fedf1326454391984eeb8a75ad3979ef8eac862e1b78ee2622,17951521209150654,a6e6ff165edb43af14c65d94a9b0f986e097e6ded5770ad0bf8f5f1555999cd3,https://www.instagram.com/p/DYy78rDvRNp/,DYy78rDvRNp,@ericahyadi_,Waktu habis sia-sia untuk masalah jukir...,2026-05-27T00:33:10.000Z,2026-06-06T05:09:56Z,Q_dbfc5d8a7527,new,true
3e079bad75d91cf20fce7a920b62fba7aab937a864294e636e9571cfbfcef030,18103413575080451,a6e6ff165edb43af14c65d94a9b0f986e097e6ded5770ad0bf8f5f1555999cd3,https://www.instagram.com/p/DYy78rDvRNp/,DYy78rDvRNp,@ericahyadi_,Tetap mereka banyak tunai mintanya,2026-05-26T22:47:08.000Z,2026-06-06T05:09:56Z,Q_dbfc5d8a7527,new,true
91d868d7a619bfa59c72b00db5faf32df8d473f6f2e109da5ff78a35fcb02a11,18118238206689953,a6e6ff165edb43af14c65d94a9b0f986e097e6ded5770ad0bf8f5f1555999cd3,https://www.instagram.com/p/DYy78rDvRNp/,DYy78rDvRNp,@ericahyadi_,"Ijin melapor, tolong sidak di bakso pak Salim Jl. Mulyosari dekat bank permata belok kanan gang buntu Jukir sudah ada. Karcis parkir ada namun belum menggunakan parkir digital.  Mohon segera ditindak lanjuti @wasdal @merpati.dishubsby @ericahyadi_ @samaptapolrestabessby",2026-05-26T18:48:46.000Z,2026-06-06T05:09:56Z,Q_dbfc5d8a7527,new,true
b703cf36ca9aef474d3027b80ffad0d2db9216bdf73afe39f1a62457785f2301,17912906148400827,a6e6ff165edb43af14c65d94a9b0f986e097e6ded5770ad0bf8f5f1555999cd3,https://www.instagram.com/p/DYy78rDvRNp/,DYy78rDvRNp,@ericahyadi_,Ampel pak AKEH mafia tolong parkir e larang,2026-05-26T17:25:09.000Z,2026-06-06T05:09:56Z,Q_dbfc5d8a7527,new,true
748a1af06a82bfdd372a2ca05fc73d4b9090d1a3a58cb8ff9fdb66c28058dbc1,18012970709855237,a6e6ff165edb43af14c65d94a9b0f986e097e6ded5770ad0bf8f5f1555999cd3,https://www.instagram.com/p/DYy78rDvRNp/,DYy78rDvRNp,@ericahyadi_,Kedungdoro knpa gk diobraki jalan k.h mas masyur diobraki,2026-05-26T14:43:03.000Z,2026-06-06T05:09:56Z,Q_dbfc5d8a7527,new,true
80485dd19d080d4cd11d69a889e799445efb01348eeefd9e681fdc998d1b07a0,17895257349467717,a6e6ff165edb43af14c65d94a9b0f986e097e6ded5770ad0bf8f5f1555999cd3,https://www.instagram.com/p/DYy78rDvRNp/,DYy78rDvRNp,@ericahyadi_,Kapasan simokerto jalan kenjeran kpan di sidak,2026-05-26T14:42:25.000Z,2026-06-06T05:09:56Z,Q_dbfc5d8a7527,new,true
caf52988f6e1d61e4e1f4a6d972729052dc9b86aa8f1ecbd8b3080e77f923c02,18088072469204562,204417ddec8dfe309767a170f27917b9b8e76f41534fd88839ee3d6d548f4bb8,https://www.instagram.com/p/DY6kxinv2tw/,DY6kxinv2tw,@ericahyadi_,Dalan rusak di memang kudu di apiki,2026-06-03T12:00:36.000Z,2026-06-06T05:10:10Z,Q_9a84a8a688c3,new,true
72ccadb59d6c71a9b14a01ac37144e51c61baa4a60007e39d344738443d92aba,18586843762061389,204417ddec8dfe309767a170f27917b9b8e76f41534fd88839ee3d6d548f4bb8,https://www.instagram.com/p/DY6kxinv2tw/,DY6kxinv2tw,@ericahyadi_,Bukit Darmo Golf kapan di Hotmix pak Eri,2026-06-03T02:25:06.000Z,2026-06-06T05:10:10Z,Q_9a84a8a688c3,new,true
a058d2461d643e7f8b14006c706326c6d91bf5a70a5a2a79c6c029917b6e7439,18105188251786953,204417ddec8dfe309767a170f27917b9b8e76f41534fd88839ee3d6d548f4bb8,https://www.instagram.com/p/DY6kxinv2tw/,DY6kxinv2tw,@ericahyadi_,"Pak Eri Sehat slalu❤️🔥 ikan teri ikan babat , sampun di teri pun boten sambat , niku menungso ,,,😂😂😂 pun keturutan hajatnya",2026-06-02T23:06:09.000Z,2026-06-06T05:10:10Z,Q_9a84a8a688c3,new,true
e4536ea45923fc01d58467165a7605de125192cbbcff9c4685ce1e0310a1a69b,18373670833200030,204417ddec8dfe309767a170f27917b9b8e76f41534fd88839ee3d6d548f4bb8,https://www.instagram.com/p/DY6kxinv2tw/,DY6kxinv2tw,@ericahyadi_,Aku loh cak komplain jl Jagalan sing pating semrawut parkirane gk direken blass 😢,2026-06-02T04:08:24.000Z,2026-06-06T05:10:10Z,Q_9a84a8a688c3,new,true
e5096984db246bf6ce3e5f4c436d051998aa27d2edb250cafc5eef1ab56ac1d7,18010159826909535,204417ddec8dfe309767a170f27917b9b8e76f41534fd88839ee3d6d548f4bb8,https://www.instagram.com/p/DY6kxinv2tw/,DY6kxinv2tw,@ericahyadi_,"Inilah sejarah walikota surabaya yg cuma bisa gimmick,... Gak ada program jelas yg nyata,,...
Semoga kedepannya gak ada lgi walikota surabaya yg sprti ini",2026-05-31T14:18:16.000Z,2026-06-06T05:10:10Z,Q_9a84a8a688c3,new,true
32e0963248706e1af34e297c09e192cdcd5a7f0d7b6a46c6340f78366bc6968b,17918957151166570,204417ddec8dfe309767a170f27917b9b8e76f41534fd88839ee3d6d548f4bb8,https://www.instagram.com/p/DY6kxinv2tw/,DY6kxinv2tw,@ericahyadi_,"Bismillah, Pak @ericahyadi_ Mohon warga Ketintang Madya Surabaya yang juga tempat tinggal bapak, diberikan edukasi untuk tidak membuat larangan memberikan makanan kepada kucing liar/ domestik. Mereka makhluk hidup harus kita sayangi juga, sebagian dari rezeki kita adalah milik mereka juga. Sangat kecewa dengan pemasangan poster larangan memberi makan kucing di 2 area Ketintang Madya. Memiliki belas kasih/ empati dan perhatian ke hewan yang lemah, Allah akan balas kebaikan itu berlipat. Bumi ini luas dan milik seluruh makhluk hidup, bukan hanya manusia sebagai makhluk mayoritas. Mohon diperhatikan. Terima kasih pak.",2026-05-31T11:57:11.000Z,2026-06-06T05:10:10Z,Q_9a84a8a688c3,new,true
019fc0310ed1720e37ed031df4c420a5ce5e5eda8a9877d0ac48277809c8f9b5,17883807819569248,204417ddec8dfe309767a170f27917b9b8e76f41534fd88839ee3d6d548f4bb8,https://www.instagram.com/p/DY6kxinv2tw/,DY6kxinv2tw,@ericahyadi_,Lucu awk mu rii gae pendaftaran online sensus tp seng ke pilih wong mu kabeh 😂,2026-05-31T06:28:16.000Z,2026-06-06T05:10:10Z,Q_9a84a8a688c3,new,true
5d83a1d8a39dfce63771212640e3392b3d332e163c01cfc6c076253b5a910c35,18114001969864781,204417ddec8dfe309767a170f27917b9b8e76f41534fd88839ee3d6d548f4bb8,https://www.instagram.com/p/DY6kxinv2tw/,DY6kxinv2tw,@ericahyadi_,"NGUTAMAKNO PARKIR TOK AE CAKKK CAKKK.. RAKYATMU MBAMBET IKU LO DISAWANG!! SEPEDAH MOTOR BENDINO ILANG, DALAN GA ENAK. Seng diutamakan mung PARKIRAN PARKIRAN PARKIRAN!! Dadio BUPATI MEDUROO AE KONN",2026-05-30T17:59:10.000Z,2026-06-06T05:10:10Z,Q_9a84a8a688c3,new,true
c07559eec3f3944be3c9732321ee915208f73a492b7f8a8539f9111793699f56,17996225378781768,204417ddec8dfe309767a170f27917b9b8e76f41534fd88839ee3d6d548f4bb8,https://www.instagram.com/p/DY6kxinv2tw/,DY6kxinv2tw,@ericahyadi_,Seharusnya ada team survey jalan... Mana2 yg harus segera diperbaiki jalannya,2026-05-30T17:05:25.000Z,2026-06-06T05:10:10Z,Q_9a84a8a688c3,new,true
204432f281a9bbd95e78a7a3bd7130f8c9b2840c10686f90cd600f97f2c3d2c8,18409347280196828,204417ddec8dfe309767a170f27917b9b8e76f41534fd88839ee3d6d548f4bb8,https://www.instagram.com/p/DY6kxinv2tw/,DY6kxinv2tw,@ericahyadi_,"Laporrrrr setelah lewat jalan kyai Abdul Karim Rungkut menanggal Surabaya bangunan liarnya makin kokoh bahkan sudah ada yg permanen pakai batu bata lebih kokoh dari rumah warga di belakangnya yg tertutup hampir satu jalanan,butuh perhatian khusus Pemkot",2026-05-30T15:15:52.000Z,2026-06-06T05:10:10Z,Q_9a84a8a688c3,new,true
e8869d95c6aef171ad8bcf39c4632c89ca914b83572ca6b920852036dbede045,17943453333080632,204417ddec8dfe309767a170f27917b9b8e76f41534fd88839ee3d6d548f4bb8,https://www.instagram.com/p/DY6kxinv2tw/,DY6kxinv2tw,@ericahyadi_,Semua jalan di sby pak di cek 1 1 kalo Ono sing rusak langsung betulkan biar apik 🔥,2026-05-30T12:06:24.000Z,2026-06-06T05:10:10Z,Q_9a84a8a688c3,new,true
28ec255644eb91a5e3f3e641655a586039d276da2cc4ceac1f6857972e19de10,18339426877221156,204417ddec8dfe309767a170f27917b9b8e76f41534fd88839ee3d6d548f4bb8,https://www.instagram.com/p/DY6kxinv2tw/,DY6kxinv2tw,@ericahyadi_,njlok tolong jl jemur sari seng ate arah sidoarjo pak jeglongan e pwol pwol an,2026-05-30T05:42:16.000Z,2026-06-06T05:10:10Z,Q_9a84a8a688c3,new,true
69bf4992c9c3fa5d82af8c0cf36f0d1f2e2046f663a3d23008372ebecc5a4c7f,18079291508233660,204417ddec8dfe309767a170f27917b9b8e76f41534fd88839ee3d6d548f4bb8,https://www.instagram.com/p/DY6kxinv2tw/,DY6kxinv2tw,@ericahyadi_,"Terimakasih Cak' Eri Cahyadi sudah merespon keluhan saya. 
Terimakasih 🙇",2026-05-30T00:49:52.000Z,2026-06-06T05:10:10Z,Q_9a84a8a688c3,new,true
57472242a1704baed046c67ca0933e16dfa15674036d181e87f5c8bf58268679,17892397050498445,204417ddec8dfe309767a170f27917b9b8e76f41534fd88839ee3d6d548f4bb8,https://www.instagram.com/p/DY6kxinv2tw/,DY6kxinv2tw,@ericahyadi_,"privilege surabaya pusat,
warga surabaya barat khususnya dr balongsari - manukan - benowo seng sabar ngerasakno dalan gak enak",2026-05-30T00:23:32.000Z,2026-06-06T05:10:10Z,Q_9a84a8a688c3,new,true
5c0b8428d7623d7a5a8d7f098eb1aeb92486afdfd7ce1b47b398177c3f567d24,18132807127577279,204417ddec8dfe309767a170f27917b9b8e76f41534fd88839ee3d6d548f4bb8,https://www.instagram.com/p/DY6kxinv2tw/,DY6kxinv2tw,@ericahyadi_,👏👏,2026-05-29T23:49:30.000Z,2026-06-06T05:10:10Z,Q_9a84a8a688c3,new,true
b743c1c8d278070b1f377cf3603a1d7df02f16cfedab544845cf40d4673f7da7,18051569528523692,576dcfc739d68e8c990bd2f7e36e4c2be90030d014d5cea335988073240d827e,https://www.instagram.com/p/DZFWAoUvskg/,DZFWAoUvskg,@ericahyadi_,Masih Ono AE sing bakar sampah,2026-06-04T12:49:36.000Z,2026-06-06T05:10:25Z,Q_d4c3173bf95c,new,true
44428736094ce7d00bc7b328555964453dd3e7eaf14d57fffab4969e26b6be38,18104464499079588,576dcfc739d68e8c990bd2f7e36e4c2be90030d014d5cea335988073240d827e,https://www.instagram.com/p/DZFWAoUvskg/,DZFWAoUvskg,@ericahyadi_,Kebiasaan ndeso digowo nak kota😢,2026-06-04T05:28:04.000Z,2026-06-06T05:10:25Z,Q_d4c3173bf95c,new,true
b71a9373ad92de7216b94eddc2ad504d73b12ce0c88a7e43917459ecf88256a7,18134338219499056,576dcfc739d68e8c990bd2f7e36e4c2be90030d014d5cea335988073240d827e,https://www.instagram.com/p/DZFWAoUvskg/,DZFWAoUvskg,@ericahyadi_,Harus ne Ono kesadaran diri dari masyarakat,2026-06-03T12:12:35.000Z,2026-06-06T05:10:25Z,Q_d4c3173bf95c,new,true
c36bc9f26337a8635ea1386ddea35125a3239cc64efb75781581696a83e2cc90,17971907781059236,576dcfc739d68e8c990bd2f7e36e4c2be90030d014d5cea335988073240d827e,https://www.instagram.com/p/DZFWAoUvskg/,DZFWAoUvskg,@ericahyadi_,"Saran ku buat tempat khusus pemilahan sampah pak , biar cepat saat mau di daur ulang",2026-06-03T12:09:59.000Z,2026-06-06T05:10:25Z,Q_d4c3173bf95c,new,true
fc3fa04afb7f20ce4dab0776e8e506171d2703826fe4121e8ef04ea1b90a1a0d,18391473070089837,576dcfc739d68e8c990bd2f7e36e4c2be90030d014d5cea335988073240d827e,https://www.instagram.com/p/DZFWAoUvskg/,DZFWAoUvskg,@ericahyadi_,Coba beli alat yang buat dapur ulang sampah pak,2026-06-03T11:57:41.000Z,2026-06-06T05:10:25Z,Q_d4c3173bf95c,new,true
2e0f764c8f09d85d56c5da6e585162c7f497f259160ca3322b2e830e76ce78d2,18100986968039250,576dcfc739d68e8c990bd2f7e36e4c2be90030d014d5cea335988073240d827e,https://www.instagram.com/p/DZFWAoUvskg/,DZFWAoUvskg,@ericahyadi_,Surabaya darurat curanmor 😢,2026-06-03T11:52:06.000Z,2026-06-06T05:10:25Z,Q_d4c3173bf95c,new,true
fa82c7d63d78830a59973cd14ddc69a324301356295953943d617ac79d4010fe,18124481362651301,576dcfc739d68e8c990bd2f7e36e4c2be90030d014d5cea335988073240d827e,https://www.instagram.com/p/DZFWAoUvskg/,DZFWAoUvskg,@ericahyadi_,🔥🔥🔥,2026-06-03T10:15:34.000Z,2026-06-06T05:10:25Z,Q_d4c3173bf95c,new,true
cfd973479ffcd8e1544ef06a980fa40367edb48c865f34e504e252ee1cbd3713,18365381362225433,576dcfc739d68e8c990bd2f7e36e4c2be90030d014d5cea335988073240d827e,https://www.instagram.com/p/DZFWAoUvskg/,DZFWAoUvskg,@ericahyadi_,"Pak knp pengurus an pindah KK di SBY skrg rumit skali, pkek sistem online hrus unggah sertifikat rumah segala... Kok makin ruwet... Dulu pengurusan pindah KK, KTP 2jam jdi... Ini kok ruwet skali.. Makin rumit",2026-06-03T08:12:31.000Z,2026-06-06T05:10:25Z,Q_d4c3173bf95c,new,true
269edc1625abc87a5f1e45eb89dd685e2de5cf76a99b06f77031dc1b1b4ca1e7,18587571445013065,576dcfc739d68e8c990bd2f7e36e4c2be90030d014d5cea335988073240d827e,https://www.instagram.com/p/DZFWAoUvskg/,DZFWAoUvskg,@ericahyadi_,"Sik wakeh wong udik (pdhl urip nang kota besar)..nek di elingno, ga trimo..",2026-06-03T07:58:31.000Z,2026-06-06T05:10:25Z,Q_d4c3173bf95c,new,true
3653d56a835e4219202bdfbdc151fd0c4d5f04892bcb7ec69fc27d1d0b979ecf,18542353915069865,576dcfc739d68e8c990bd2f7e36e4c2be90030d014d5cea335988073240d827e,https://www.instagram.com/p/DZFWAoUvskg/,DZFWAoUvskg,@ericahyadi_,Cak Tolong Suromadu iku daripada membahayakan karena besi besi ne di colongi wong Meduro Dewe mending sampean inisiatif diambrukno ae sekalian maren Jembatan Suramadu daripada membahayakan .. wes Ndang Ambrukno ae Cak,2026-06-03T07:01:07.000Z,2026-06-06T05:10:25Z,Q_d4c3173bf95c,new,true
faeba2275dde37d13e42d05207c3d2b9c035797985c421373caa48ebc38a5cae,18100476199896353,576dcfc739d68e8c990bd2f7e36e4c2be90030d014d5cea335988073240d827e,https://www.instagram.com/p/DZFWAoUvskg/,DZFWAoUvskg,@ericahyadi_,😍😍😍😍,2026-06-03T03:55:37.000Z,2026-06-06T05:10:25Z,Q_d4c3173bf95c,new,true
77b61307e46155ca6e1443aaf1511f49e8973b63c0fda690fe37cc8699cae7ca,18057998936546209,576dcfc739d68e8c990bd2f7e36e4c2be90030d014d5cea335988073240d827e,https://www.instagram.com/p/DZFWAoUvskg/,DZFWAoUvskg,@ericahyadi_,Ok,2026-06-03T03:26:41.000Z,2026-06-06T05:10:25Z,Q_d4c3173bf95c,new,true
cbc01617b6ec615258577825ebfd0d870566041793221a7cf24749ddc923ff34,18094363631249863,576dcfc739d68e8c990bd2f7e36e4c2be90030d014d5cea335988073240d827e,https://www.instagram.com/p/DZFWAoUvskg/,DZFWAoUvskg,@ericahyadi_,Kok okeh maling motor saiki cak.. Sampeyan tau kan berita gini di surabaya..,2026-06-03T00:25:43.000Z,2026-06-06T05:10:25Z,Q_d4c3173bf95c,new,true
7e7db24b5b010064352cc67e65e668e765ce8d9c78caf5c872732b9b4a4b856f,18014314124909092,576dcfc739d68e8c990bd2f7e36e4c2be90030d014d5cea335988073240d827e,https://www.instagram.com/p/DZFWAoUvskg/,DZFWAoUvskg,@ericahyadi_,Lha coba dicek sekarang tiap pagi sampah2 daun dibakar sama tukang sapu jalan. Padahal dulu diangkut pake mobil 😂,2026-06-02T21:09:59.000Z,2026-06-06T05:10:25Z,Q_d4c3173bf95c,new,true
fc2e98938ae0fd4f6a296c52fe348eebd3687a9085948df1205f2a00bcf253e6,17933619738273382,576dcfc739d68e8c990bd2f7e36e4c2be90030d014d5cea335988073240d827e,https://www.instagram.com/p/DZFWAoUvskg/,DZFWAoUvskg,@ericahyadi_,Pak njaluk tulung suramadu diperketat maneh suwon..,2026-06-02T17:59:45.000Z,2026-06-06T05:10:25Z,Q_d4c3173bf95c,new,true
3f948d1c24e9c8867004603d761b92bd66031c7e86d4d1330bed1b3d74cab2ec,18103787395823505,eeafb0ef05ea98e2e544e4c04b15914d9e4eb3698d99f6b5c80d9fb73d348805,https://www.instagram.com/p/DZH4gwWPdjG/,DZH4gwWPdjG,@ericahyadi_,"Halah ro meduro... Walikota meduro ngurusin parkir liar ga pernah beres.. Ehh bolomu dewe yo, tukang parkir liar itu?",2026-06-06T05:03:51.000Z,2026-06-06T05:10:39Z,Q_b74c31a7e9ac,new,true
f04a9efbbf4723ce94097af23baef2878da0e86a5203d5e6047b4c8a1b87cc83,18085869530575438,eeafb0ef05ea98e2e544e4c04b15914d9e4eb3698d99f6b5c80d9fb73d348805,https://www.instagram.com/p/DZH4gwWPdjG/,DZH4gwWPdjG,@ericahyadi_,"Kontenmu katah, nyatanya apa ?",2026-06-06T05:02:48.000Z,2026-06-06T05:10:39Z,Q_b74c31a7e9ac,new,true
a68b903528c24fd5482cb3f7975bd38adb31bdddc0b62b53ae7b23e5ef5460ab,17954746035140970,eeafb0ef05ea98e2e544e4c04b15914d9e4eb3698d99f6b5c80d9fb73d348805,https://www.instagram.com/p/DZH4gwWPdjG/,DZH4gwWPdjG,@ericahyadi_,"Alhamdulillah wes ditambal, nah saiki enten masalah nyar, nek nambal dalan iku sing nggenah... Angger tempel2 dilungkas bolong neh, tambah dadi blendukan ga karu2an",2026-06-06T03:52:55.000Z,2026-06-06T05:10:39Z,Q_b74c31a7e9ac,new,true
41afb2bb85b2b11c0d3a76c026c267a34b840d7ca6e5fc7c73177d858a6cd2eb,18120293743665210,eeafb0ef05ea98e2e544e4c04b15914d9e4eb3698d99f6b5c80d9fb73d348805,https://www.instagram.com/p/DZH4gwWPdjG/,DZH4gwWPdjG,@ericahyadi_,tolong jalan banyu urip arah benowo daerah manukan nemen iku,2026-06-06T03:04:16.000Z,2026-06-06T05:10:39Z,Q_b74c31a7e9ac,new,true
3fd424fcaadfc74b2fb2738ed15f5621876d532fe1171559231971ec1b6482c3,18351193732300367,eeafb0ef05ea98e2e544e4c04b15914d9e4eb3698d99f6b5c80d9fb73d348805,https://www.instagram.com/p/DZH4gwWPdjG/,DZH4gwWPdjG,@ericahyadi_,Jhozjhiz jhozjhiz❤️❤️🔥🔥🔥,2026-06-06T02:54:29.000Z,2026-06-06T05:10:39Z,Q_b74c31a7e9ac,new,true
e193cb7c4135636a684fc2bee8af8d7d36bca8ef1d3e35c07bb9f871cea3c710,17969416215098282,eeafb0ef05ea98e2e544e4c04b15914d9e4eb3698d99f6b5c80d9fb73d348805,https://www.instagram.com/p/DZH4gwWPdjG/,DZH4gwWPdjG,@ericahyadi_,Jalan Manukan - sememi pakkk bnyk yg berlubang. Bahkan seringkali  buat pengendara jatuh ( laka) 🙏,2026-06-06T00:20:13.000Z,2026-06-06T05:10:39Z,Q_b74c31a7e9ac,new,true
a721bbaec27a617d7369eee41e1c074b4dd7c7ceda110f14bf3867c950f63a2e,17890686960538000,eeafb0ef05ea98e2e544e4c04b15914d9e4eb3698d99f6b5c80d9fb73d348805,https://www.instagram.com/p/DZH4gwWPdjG/,DZH4gwWPdjG,@ericahyadi_,"Pak, masih ada yg bakar sampah di sore hari di pinggir kali jagir, tepat nya dekat TPS. Ini sangat mengganggu kesehatan.",2026-06-05T15:25:49.000Z,2026-06-06T05:10:39Z,Q_b74c31a7e9ac,new,true
f0c3d972d43a119936fc78be5fd5022b11e387201954f1f4a575a49f3605de5a,17974827524889005,eeafb0ef05ea98e2e544e4c04b15914d9e4eb3698d99f6b5c80d9fb73d348805,https://www.instagram.com/p/DZH4gwWPdjG/,DZH4gwWPdjG,@ericahyadi_,Sopo seh iki??😂,2026-06-05T15:19:31.000Z,2026-06-06T05:10:39Z,Q_b74c31a7e9ac,new,true
9f4cb4f260f1c103bc110c7e33c15f8872231bd2e3b4a8b49616bbd9830248aa,18113428624883505,eeafb0ef05ea98e2e544e4c04b15914d9e4eb3698d99f6b5c80d9fb73d348805,https://www.instagram.com/p/DZH4gwWPdjG/,DZH4gwWPdjG,@ericahyadi_,"Pak Eri, saya uda dm dari sebulan yg lalu Pak blm ada tanggapan. Tolong jalan dari manukan sampe benowo Pak. Boyok ancur Pak. Maturnuwun Pak",2026-06-05T14:59:31.000Z,2026-06-06T05:10:39Z,Q_b74c31a7e9ac,new,true
81033954e1d1340c1009abbc5de9d562b28ca0024996d818e7aa01c3aecaa1ce,17946619644198654,eeafb0ef05ea98e2e544e4c04b15914d9e4eb3698d99f6b5c80d9fb73d348805,https://www.instagram.com/p/DZH4gwWPdjG/,DZH4gwWPdjG,@ericahyadi_,Pak mohon ijin lapor jalan raya banjar sugihan setelah stasiun kandangan sampai smp 26 ada plat besi sambungan aspal yg mencuat  keluar di jalan .. bahaya utk pengendara apalagi kalo malam lampu pju minim banyak yg mati,2026-06-05T13:43:58.000Z,2026-06-06T05:10:39Z,Q_b74c31a7e9ac,new,true
fded3d78cfdb86e483166eb3b09e9a24ddc3849c76d12d6d91af2394543ab5a8,17997389816959883,eeafb0ef05ea98e2e544e4c04b15914d9e4eb3698d99f6b5c80d9fb73d348805,https://www.instagram.com/p/DZH4gwWPdjG/,DZH4gwWPdjG,@ericahyadi_,"@ericahyadi_ bos mlaku""o nag jogja deloken iku dalanae jogja mulus"" la iki sby kota gede umr gede dalan tembel"" tok iki dalan ta ban njero  pateng tembel kabeh ngonten tok ae",2026-06-05T13:17:38.000Z,2026-06-06T05:10:39Z,Q_b74c31a7e9ac,new,true
172ff8d8849ddc6daa2742384383768425384432b764be40448a3707d0a2f960,18085660088108269,eeafb0ef05ea98e2e544e4c04b15914d9e4eb3698d99f6b5c80d9fb73d348805,https://www.instagram.com/p/DZH4gwWPdjG/,DZH4gwWPdjG,@ericahyadi_,lagunya mantap mas🥰 silampukau,2026-06-05T12:13:49.000Z,2026-06-06T05:10:39Z,Q_b74c31a7e9ac,new,true
5850bb0a72b3761926f6eeca2735f58a6022e7038897947d645762bef4d32c37,17871977142523250,eeafb0ef05ea98e2e544e4c04b15914d9e4eb3698d99f6b5c80d9fb73d348805,https://www.instagram.com/p/DZH4gwWPdjG/,DZH4gwWPdjG,@ericahyadi_,Tukang narik sampah rt ku mulai ngeluh nang depo kalirungkut,2026-06-05T11:06:27.000Z,2026-06-06T05:10:39Z,Q_b74c31a7e9ac,new,true
607e5341939cbc526c274cfaa64c1f0c2dab70ee8253091b06443d794ee25d26,18091134857598301,eeafb0ef05ea98e2e544e4c04b15914d9e4eb3698d99f6b5c80d9fb73d348805,https://www.instagram.com/p/DZH4gwWPdjG/,DZH4gwWPdjG,@ericahyadi_,kakean gedabusss...banyu urip sampek benowo jalane jeglong kabeh..gk usah kakekan alasan rii,2026-06-05T10:52:50.000Z,2026-06-06T05:10:39Z,Q_b74c31a7e9ac,new,true
f768ddaad22d11294e0231016925772397cba14431a7188989485f861db74578,17941570323227370,eeafb0ef05ea98e2e544e4c04b15914d9e4eb3698d99f6b5c80d9fb73d348805,https://www.instagram.com/p/DZH4gwWPdjG/,DZH4gwWPdjG,@ericahyadi_,Gimana untuk Jukir Liar kok tidak ada kejelasan... Malah di pelihara jukir2 liar? Ayo jawab jangan cuma bisa nya  ngomong paham sampai disini saja.. Ngurus Jalan karah saja masih gak beres kok sok bilang paham sampai disini,2026-06-05T09:02:55.000Z,2026-06-06T05:10:39Z,Q_b74c31a7e9ac,new,true
54ce59c5e0a2808c8767a5ceb7383dabea1c4e4be4fecea12401698695a35ceb,17901958302442811,b02c12141906f75efba0a46b5155ee355321006b19ebdda44bc0b12c3d62b695,https://www.instagram.com/p/DYwloKQvZIk/,DYwloKQvZIk,@ericahyadi_,ingat. kesadaran masyarakatnya. coba kalo semisal kita buang sampah di tmpt semestinya dan dipilah. coba kita tertib dalam berkendara dan berlalu lintas. coba kita taat aturan yang berlaku. coba coba coba coba 😇,2026-06-03T04:11:52.000Z,2026-06-06T05:10:50Z,Q_2d42776451e3,new,true
