comment_id_hash,comment_id,post_id_hash,post_url,post_shortcode,source_account,comment_text,comment_created_at,scraped_at,queue_id,scraping_status,is_baseline
b9e971038e1024aef9721d090d8f0431061070d6c76aabb187af43674b149263,18264266110293838,0063ffd28a7bd4bd30394c859c98eb37a98b790f22a0921f108dbc65df66e6d2,https://www.instagram.com/p/DXtmHQCD58t/,DXtmHQCD58t,@ericahyadi_,"Kerja nyata terus Cak, warga pasti dukung",2026-05-06T13:12:07.000Z,2026-06-06T05:19:12Z,Q_e51179e73e83,new,true
02878f4ca868597007d549316dd946823a089c09d0525168e53ee9a7b198aa80,17950283037160950,0063ffd28a7bd4bd30394c859c98eb37a98b790f22a0921f108dbc65df66e6d2,https://www.instagram.com/p/DXtmHQCD58t/,DXtmHQCD58t,@ericahyadi_,"Kerja nyata terus Cak, warga pasti dukung",2026-05-06T13:08:41.000Z,2026-06-06T05:19:12Z,Q_e51179e73e83,new,true
63b8e360af649507f939f2bf42b7e76aca186b7833174d6d694627649ba0ac8c,18096855928891525,0063ffd28a7bd4bd30394c859c98eb37a98b790f22a0921f108dbc65df66e6d2,https://www.instagram.com/p/DXtmHQCD58t/,DXtmHQCD58t,@ericahyadi_,Mantul! Semoga Margorejo bebas banjir tahun iki,2026-05-06T13:07:16.000Z,2026-06-06T05:19:12Z,Q_e51179e73e83,new,true
7fb6f1a2abcf6eb0a396843a1e169c1977d52336bae4a0398d1dd644e6afd48e,18339489508175990,0063ffd28a7bd4bd30394c859c98eb37a98b790f22a0921f108dbc65df66e6d2,https://www.instagram.com/p/DXtmHQCD58t/,DXtmHQCD58t,@ericahyadi_,"Nah iki baru, saluran dioptimalkan kabeh",2026-05-06T13:06:04.000Z,2026-06-06T05:19:12Z,Q_e51179e73e83,new,true
4580ab01df9f163e5d2de61715763a59e196191b9dade03ac08eabffd48cb70e,18122940217625454,0063ffd28a7bd4bd30394c859c98eb37a98b790f22a0921f108dbc65df66e6d2,https://www.instagram.com/p/DXtmHQCD58t/,DXtmHQCD58t,@ericahyadi_,Tak kiro arep main sepakbola....,2026-05-06T13:01:45.000Z,2026-06-06T05:19:12Z,Q_e51179e73e83,new,true
3eff815c755b8dd99c52cee152a88e2ef09aaba3e29bb5b4edd8d3be93addc42,18534971047072045,0063ffd28a7bd4bd30394c859c98eb37a98b790f22a0921f108dbc65df66e6d2,https://www.instagram.com/p/DXtmHQCD58t/,DXtmHQCD58t,@ericahyadi_,"Iki baru walikota rek, kerja jelas arah e!",2026-05-06T13:00:20.000Z,2026-06-06T05:19:12Z,Q_e51179e73e83,new,true
7935cebe5db2e54944629b7dfae2e6621af589fca77c0d62988b96d63b8d2d71,17878583025588715,2ba00978f1f93ee8a3d1ac8ea23c8bfb40472b9fb0a1408807f0790252e09709,https://www.instagram.com/p/DXmG2iTj__o/,DXmG2iTj__o,@ericahyadi_,"Saya warga putat gede ,semoga bpk di beri kesehatan umur panjang yg barokah🤲🤲🤲",2026-05-09T11:44:59.000Z,2026-06-06T05:19:21Z,Q_910ddb57788b,new,true
903238cae6188b907994b7cd123e84c040c9881702164725665f4b17768b997d,18087915725376336,2ba00978f1f93ee8a3d1ac8ea23c8bfb40472b9fb0a1408807f0790252e09709,https://www.instagram.com/p/DXmG2iTj__o/,DXmG2iTj__o,@ericahyadi_,tikete KBS larang nemen. Ragunan ae gak sampai sepuluh ribu.,2026-05-09T04:48:44.000Z,2026-06-06T05:19:21Z,Q_910ddb57788b,new,true
ab29c4b19e22ce1eff8207108788de73038b8d1c99f30e2d1042b34fe43dd7af,18108173542930117,2ba00978f1f93ee8a3d1ac8ea23c8bfb40472b9fb0a1408807f0790252e09709,https://www.instagram.com/p/DXmG2iTj__o/,DXmG2iTj__o,@ericahyadi_,TK MANDALA😂,2026-05-05T18:21:23.000Z,2026-06-06T05:19:21Z,Q_910ddb57788b,new,true
2752ac7654658a4f7d92ec4f7f9d595c0a57b521d1548888b1f67ed945ed17d5,18584907058024888,2ba00978f1f93ee8a3d1ac8ea23c8bfb40472b9fb0a1408807f0790252e09709,https://www.instagram.com/p/DXmG2iTj__o/,DXmG2iTj__o,@ericahyadi_,🔥,2026-05-03T11:45:39.000Z,2026-06-06T05:19:21Z,Q_910ddb57788b,new,true
dabc520ca1a9fd743c4f631ab1f55f586abb8c920ddb09f4a5a5a97e3c239c3e,18087179624051228,2ba00978f1f93ee8a3d1ac8ea23c8bfb40472b9fb0a1408807f0790252e09709,https://www.instagram.com/p/DXmG2iTj__o/,DXmG2iTj__o,@ericahyadi_,Ditunggu satwa baru nya,2026-05-01T10:46:07.000Z,2026-06-06T05:19:21Z,Q_910ddb57788b,new,true
24093642535815e6083e0e0ef48140e15b02878ce17382bc74fb23f8550a0a34,18536864269068681,2ba00978f1f93ee8a3d1ac8ea23c8bfb40472b9fb0a1408807f0790252e09709,https://www.instagram.com/p/DXmG2iTj__o/,DXmG2iTj__o,@ericahyadi_,keren pol memang pak wali,2026-05-01T10:42:44.000Z,2026-06-06T05:19:21Z,Q_910ddb57788b,new,true
3991e9dfe19210f9f899918229a32c9c880854d1db012fe808b5a12c51855565,18074019938373174,2ba00978f1f93ee8a3d1ac8ea23c8bfb40472b9fb0a1408807f0790252e09709,https://www.instagram.com/p/DXmG2iTj__o/,DXmG2iTj__o,@ericahyadi_,🔥,2026-05-01T10:36:38.000Z,2026-06-06T05:19:21Z,Q_910ddb57788b,new,true
bf2dd2a9b742c7b802b0b8b9ef334a7809a61b1ba13e5196c0ca9508fa347574,18051877124754461,2ba00978f1f93ee8a3d1ac8ea23c8bfb40472b9fb0a1408807f0790252e09709,https://www.instagram.com/p/DXmG2iTj__o/,DXmG2iTj__o,@ericahyadi_,"Pak singkat saja, KAMI MASYARAKAT ANAK ANAK MUDA SURABAYA KECEWA DENGAN KINERJA BAPAK, KETIDAKMAMPUAN MEMBERIKAN KETENANGAN PERIHAL PARKIR LIAR DAN KEJAHATAN YG BANYAK DILAKUKAN OLEH ORANG ORANG MADURA,",2026-04-27T22:11:50.000Z,2026-06-06T05:19:21Z,Q_910ddb57788b,new,true
4b6737727cb14d684cb20d75576303f96cb2a7da66ae035c095e3078684fb4a7,17932619289250404,2ba00978f1f93ee8a3d1ac8ea23c8bfb40472b9fb0a1408807f0790252e09709,https://www.instagram.com/p/DXmG2iTj__o/,DXmG2iTj__o,@ericahyadi_,"Tlng rute perjalanan e di dalam kbs di atur,cek gk smerawut...semua satwa bisa dilihat... perjalanan teratur start dmn finish dmn...tiket naikin 2rb gpp...wkwkwk",2026-04-27T19:25:34.000Z,2026-06-06T05:19:21Z,Q_910ddb57788b,new,true
3a7642ff89be6f9560d8513f56247d6666f56b221547256fc15de5ac934fbba1,18168339256420594,2ba00978f1f93ee8a3d1ac8ea23c8bfb40472b9fb0a1408807f0790252e09709,https://www.instagram.com/p/DXmG2iTj__o/,DXmG2iTj__o,@ericahyadi_,Kapan lapak liar jl kyai Abdul Karim Rungkut menanggal di resmikan JD pariwisata rumah kayu?prestasi tiada tanding sedunia,2026-04-27T16:15:17.000Z,2026-06-06T05:19:21Z,Q_910ddb57788b,new,true
32f19f0139d2de0e51907d0a190552768df3e7def61088134bbb013868db7508,17887027575369997,2ba00978f1f93ee8a3d1ac8ea23c8bfb40472b9fb0a1408807f0790252e09709,https://www.instagram.com/p/DXmG2iTj__o/,DXmG2iTj__o,@ericahyadi_,"Pak eri, minta tolong cek semua daycare d surabaya, jangan sampai seperti d jogya. Searching pak ""daycare di surabaya"" pasti banyak nama². Tim bapak menuju kesana ndadak aja pak.. agar tau kebiasaan para pengasuh, ketua yayasan, dan kepala sekolah disana memperlakukan anak² tsb bagaimana. Memanusiakan manusia atau tidak.",2026-04-27T13:53:49.000Z,2026-06-06T05:19:21Z,Q_910ddb57788b,new,true
07ca626991eab71fe8452ced4bf71845c3a73fd638dfcc97019f9d60ca5f25b6,18116140915687721,2ba00978f1f93ee8a3d1ac8ea23c8bfb40472b9fb0a1408807f0790252e09709,https://www.instagram.com/p/DXmG2iTj__o/,DXmG2iTj__o,@ericahyadi_,"Parkir liar dikasih jatah, PKL lokal dipinggirkan 😢 😢😢",2026-04-27T13:26:30.000Z,2026-06-06T05:19:21Z,Q_910ddb57788b,new,true
77f45fd46fadca93d7456a7c8d55d8d601ab0dc445e5dad0f50559ae1963d77b,18124903831610843,2ba00978f1f93ee8a3d1ac8ea23c8bfb40472b9fb0a1408807f0790252e09709,https://www.instagram.com/p/DXmG2iTj__o/,DXmG2iTj__o,@ericahyadi_,PESONA BAPAK JUKIR SURABAYA,2026-04-27T10:30:41.000Z,2026-06-06T05:19:21Z,Q_910ddb57788b,new,true
18f55c7c97f2868178fac1532d63fdc1bb5275ce8debfeb40ae8246b227a80ba,17935928712208799,2ba00978f1f93ee8a3d1ac8ea23c8bfb40472b9fb0a1408807f0790252e09709,https://www.instagram.com/p/DXmG2iTj__o/,DXmG2iTj__o,@ericahyadi_,Terakhir kesana kingkongnya patung 😂😂,2026-04-27T07:46:55.000Z,2026-06-06T05:19:21Z,Q_910ddb57788b,new,true
0cfda4d7ae76d52dfd0488743a78a07eb0ace1a71ac361023ae36cd83a52ffa8,18392649724082343,2ba00978f1f93ee8a3d1ac8ea23c8bfb40472b9fb0a1408807f0790252e09709,https://www.instagram.com/p/DXmG2iTj__o/,DXmG2iTj__o,@ericahyadi_,Pak Eri untuk Aquarium di KBS sebaiknya  di Renovasi sama seperti di Coral restaurant kempinski hotel bali sangat cocok untu model aquarium di KBS.dan juga untuk THP Kenjeran dibuat sama dengan Ancol Seaworld  jakarta yg punya Antasena Tunel. Semoga  Terwujud.,2026-04-27T07:45:47.000Z,2026-06-06T05:19:21Z,Q_910ddb57788b,new,true
358a41e40c4684e1e81f1e3eb4228d4113ea4534d24b65faa09b152ff74ada53,18102769345832815,b8bd0bd099a1acf0a8e7b45ec570166b4e9f3f8552a0f91cb754c2be21d0ca02,https://www.instagram.com/p/DX8W3lgPpLv/,DX8W3lgPpLv,@ericahyadi_,Kenapa semua ikut ngurus setres,2026-05-31T12:00:09.000Z,2026-06-06T05:19:29Z,Q_9f6ebc640342,new,true
ff03ea9e0ed251ee17a46f978ddab1bdebbe9a8ad6bebf1bd214b99bd5ac870f,17938603242238428,b8bd0bd099a1acf0a8e7b45ec570166b4e9f3f8552a0f91cb754c2be21d0ca02,https://www.instagram.com/p/DX8W3lgPpLv/,DX8W3lgPpLv,@ericahyadi_,Cak ... Tanah sengketa orang tua q wes 28 tahun blm selesai....basuki Rahmat 72 sby,2026-05-25T11:15:46.000Z,2026-06-06T05:19:29Z,Q_9f6ebc640342,new,true
93850773d628902253657d2bdde4200efd38ffc587a2cfa725ec269138d6f6c3,18423638203192781,b8bd0bd099a1acf0a8e7b45ec570166b4e9f3f8552a0f91cb754c2be21d0ca02,https://www.instagram.com/p/DX8W3lgPpLv/,DX8W3lgPpLv,@ericahyadi_,Assalamualaiku cak eri jln tanjung sari masih gelombabg dan gelap lampunya ke tutup daun saya setiap hari pkl 3 subuh lewat jln itu,2026-05-22T00:05:26.000Z,2026-06-06T05:19:29Z,Q_9f6ebc640342,new,true
d336757ce71c8a81c9e98cad8e7576f65963c8490745d846611fdeb44a4c9ae6,17859997641601568,b8bd0bd099a1acf0a8e7b45ec570166b4e9f3f8552a0f91cb754c2be21d0ca02,https://www.instagram.com/p/DX8W3lgPpLv/,DX8W3lgPpLv,@ericahyadi_,Cak jalan Demak rusak 🙏🏻,2026-05-20T12:58:59.000Z,2026-06-06T05:19:29Z,Q_9f6ebc640342,new,true
a7bce7786bd76da0b055461b33610678725772f7ae17217579f4095cded93ffe,18093977653944810,b8bd0bd099a1acf0a8e7b45ec570166b4e9f3f8552a0f91cb754c2be21d0ca02,https://www.instagram.com/p/DX8W3lgPpLv/,DX8W3lgPpLv,@ericahyadi_,"Semangat cak Eri demi kemajuan Suroboyo , AQ tetap ikuti arahan yg benar💪",2026-05-19T10:04:16.000Z,2026-06-06T05:19:29Z,Q_9f6ebc640342,new,true
4a5013aaa61166cde8b9c85236233beb8c2643cc383a77c9f150ca7e7626b505,18582977071012097,b8bd0bd099a1acf0a8e7b45ec570166b4e9f3f8552a0f91cb754c2be21d0ca02,https://www.instagram.com/p/DX8W3lgPpLv/,DX8W3lgPpLv,@ericahyadi_,Pak Eri usul soal pajek saged ta,2026-05-19T08:41:21.000Z,2026-06-06T05:19:29Z,Q_9f6ebc640342,new,true
00af48fd282d6c6d022fb398972989afc4447dc21a4427a65ea4f55358c5e4b3,18325689082265946,b8bd0bd099a1acf0a8e7b45ec570166b4e9f3f8552a0f91cb754c2be21d0ca02,https://www.instagram.com/p/DX8W3lgPpLv/,DX8W3lgPpLv,@ericahyadi_,"Semangat cak Eri demi kemajuan Suroboyo , AQ tetap ikuti arahan yg benar💪",2026-05-19T08:36:08.000Z,2026-06-06T05:19:29Z,Q_9f6ebc640342,new,true
8bc0cc1934c361a3d52b6cbdb7694b36d98cccaba3e22a805dfc9c5d37b48e30,18176764720393373,b8bd0bd099a1acf0a8e7b45ec570166b4e9f3f8552a0f91cb754c2be21d0ca02,https://www.instagram.com/p/DX8W3lgPpLv/,DX8W3lgPpLv,@ericahyadi_,Betul..hati2..kaum pendatang..madas..ingin berkuasa..jamanya Narto..walikota madas..bambong Kabeh..Nang pinggir kali🤣🙂‍↕️,2026-05-19T04:48:25.000Z,2026-06-06T05:19:29Z,Q_9f6ebc640342,new,true
8c184eb59a3ff276c1ada4d352fa686a3f7c8976fd8865055a3faa4635730406,18052102061737094,b8bd0bd099a1acf0a8e7b45ec570166b4e9f3f8552a0f91cb754c2be21d0ca02,https://www.instagram.com/p/DX8W3lgPpLv/,DX8W3lgPpLv,@ericahyadi_,"Bener pak, kami pernah dtg dan curhat masalah apartemen smpai skrg gak di kutik blas 😭😭😭",2026-05-19T00:13:22.000Z,2026-06-06T05:19:29Z,Q_9f6ebc640342,new,true
9ea4f9d32d5fbd0f0ac29e6b66d0fd1c9eda8ec9c50a5f900e788c893647efa2,18100004369087236,b8bd0bd099a1acf0a8e7b45ec570166b4e9f3f8552a0f91cb754c2be21d0ca02,https://www.instagram.com/p/DX8W3lgPpLv/,DX8W3lgPpLv,@ericahyadi_,"Lapor cak Eri aku wingi mbayar parkir nang kopi kenangan jl.Sulawesi wws gae Qris tetep kenek 3ewu, nah sing bener ancen sakmunu ta 2ewu? 😂",2026-05-18T08:35:11.000Z,2026-06-06T05:19:29Z,Q_9f6ebc640342,new,true
e41c0233970fc2148c02f2c31f7c6b492d1ffbb89f21739a4044ce94fd33aa98,18123907660624949,b8bd0bd099a1acf0a8e7b45ec570166b4e9f3f8552a0f91cb754c2be21d0ca02,https://www.instagram.com/p/DX8W3lgPpLv/,DX8W3lgPpLv,@ericahyadi_,"Saya ingin dr RT, Lurah, Camat hrs mengayomi warganya, tdk pandang siapapun. Skrng ini sikit2 uang yg bisa selesai kn masalah dn kesulitan, smoga pak eri mnjdi ulur /sambutan yg tepat utk rakyat/ warga sprti kami🤲🏻😢",2026-05-18T07:36:14.000Z,2026-06-06T05:19:29Z,Q_9f6ebc640342,new,true
ab9bebc2b5cd53f5bd780e5a6d450faada2139f8de5382d5491dfb3c58a09bdd,18071571104662150,b8bd0bd099a1acf0a8e7b45ec570166b4e9f3f8552a0f91cb754c2be21d0ca02,https://www.instagram.com/p/DX8W3lgPpLv/,DX8W3lgPpLv,@ericahyadi_,Tolong pak erie surabaya makin kotor dan jalanan di achmad jais rusak berat tolong diperbaiki pak soalnya bnyk turis yg lewat untuk menuju kampung pahlawan dan dijalan tunjungan dan sekitarnya klo saya setiap jalan pagi bnyk trotoar yg rusak dan sanpah berantakan tolong itu setiap gerai di beri tempat sampah bekas makanan dan minuman di buang di jalanan achirnya kotor dan bau setiap pagi saya jalan olah raga melihat jalanan dimana mana yg rusak tolong di perhatikan pak,2026-05-18T07:06:16.000Z,2026-06-06T05:19:29Z,Q_9f6ebc640342,new,true
8cf9b49f4f9091cad7c57c50af937f990c272b8e7e891bfddc50f658e7779e7a,18436379461189547,b8bd0bd099a1acf0a8e7b45ec570166b4e9f3f8552a0f91cb754c2be21d0ca02,https://www.instagram.com/p/DX8W3lgPpLv/,DX8W3lgPpLv,@ericahyadi_,Ya pak wali tolong dilihat jalan2 di jl achmad jais .jalan Tunjungan bnyk yg rusak soalnya saya setiap hari olah raga  jalan setiap sudit2 kota ybanyak yg rusak itu kotor sekali mereka buang sampah di jalanan achirnya bauh itu yg punya toko rest.depot dan cafe tolong diberi tempat sampah karena klo ga ada tempat sampah dibuang sembarangan,2026-05-18T07:01:16.000Z,2026-06-06T05:19:29Z,Q_9f6ebc640342,new,true
ab374c00e75545068c8c7cfc075f5508cb919319a759a2017afd110e5fe65bce,18137876182531851,b8bd0bd099a1acf0a8e7b45ec570166b4e9f3f8552a0f91cb754c2be21d0ca02,https://www.instagram.com/p/DX8W3lgPpLv/,DX8W3lgPpLv,@ericahyadi_,"@@B'ali:@@B'ali:bismillah, assalamualaikum...@ GAMPANG berucap biar RAPI BERSIH ,sy kitasemua jg pengin SURABAYA SEPERTI KOTA DI SINGAPURA EROPA ,....TAPIiiiiiiiiiiiiiiiiiiiiii RAKYATNYA JUGA seyogyanya per EKONOMIan NYA JUGA HARUS diUPAYAkan seperti SINGAPURA EROPA, ADIL KAN....ADIL KAN....ADILKAN..... bukan malah MAJU KOTANE malah MUNDUR(digusurTINGGAL MEDAK tanpa JALAN KELUAR PEREKONOMIAN MEREKA PKL PKL TSB BAGAIMANA SETELAH DIGUSUR buat MENGHIDUPI KEBUTUHAN KELUARGA mereka (BIAYA SEKOLAH, MONDOK ANAK MEREKA,..biaya KONTRAKAN,..BAYAR HUTANG TAGIHAN..CICILAN., BIAYA RUMAH SAKIT ORANG TUA ANAK mereka yg mungkin sedang SAKIT PARAH?????????????,Aastaghfirullaaaaaah..... RENUNGKAN ,NURANI bilamana PANJENENGAN PARA BAPAK IBU PEMANGKU AMANAH JABATAN YG MENGALAMI KONDISI ""TERSEBUT"" . ????.
.
hampir seluruh surabaya PKL dRAPIKAN DGUSUR pindah ngalor ngidul... COBA SAMPEAN KL JALAN TENGOK KANAN KIRI BERAPA PKL YG JUALAN DI PINGGIR, ATAS SALURAN... G TERHITUNG PAK, GAK CUMA PULUHAN, RIBUAAAAAAAN PKL.... KALAU SMUA DGUSUR PINDAH NGALOR NGIDUL DITERTIBKAN JUGA... sementara PEMERINTAHE BUKANNYA NGOPENI NGAYOMI EKONOMI PENGHIDUPAN rakyat kecil malah... NAUDZUBILLAH.. #SAMPEAN MBAKULO PAK, biar ROSO ROSO EMPATI dadi wong cilik SUSAH GOLEKNPENGURIPAN NEK TANAH NEGOROE DEWE....
.
#nerapno TITIPAN AMANAH ADIL buat semua kalangan rakyat kuwi BERAT #HISABNYA",2026-05-18T02:59:14.000Z,2026-06-06T05:19:29Z,Q_9f6ebc640342,new,true
8e032fdba0c12fa2860055c16d2015301c6baa7dd1040781f286bbe192d1a85b,17889545964476992,b8bd0bd099a1acf0a8e7b45ec570166b4e9f3f8552a0f91cb754c2be21d0ca02,https://www.instagram.com/p/DX8W3lgPpLv/,DX8W3lgPpLv,@ericahyadi_,"@@B'ali:@@B'ali:bismillah, assalamualaikum...@ GAMPANG berucap biar RAPI BERSIH ,sy kitasemua jg pengin SURABAYA SEPERTI KOTA DI SINGAPURA EROPA ,....TAPIiiiiiiiiiiiiiiiiiiiiii RAKYATNYA JUGA seyogyanya per EKONOMIan NYA JUGA HARUS diUPAYAkan seperti SINGAPURA EROPA, ADIL KAN....ADIL KAN....ADILKAN..... bukan malah MAJU KOTANE malah MUNDUR(digusurTINGGAL MEDAK tanpa JALAN KELUAR PEREKONOMIAN MEREKA PKL PKL TSB BAGAIMANA SETELAH DIGUSUR buat MENGHIDUPI KEBUTUHAN KELUARGA mereka (BIAYA SEKOLAH, MONDOK ANAK MEREKA,..biaya KONTRAKAN,..BAYAR HUTANG TAGIHAN..CICILAN., BIAYA RUMAH SAKIT ORANG TUA ANAK mereka yg mungkin sedang SAKIT PARAH?????????????,Aastaghfirullaaaaaah..... RENUNGKAN ,NURANI bilamana PANJENENGAN PARA BAPAK IBU PEMANGKU AMANAH JABATAN YG MENGALAMI KONDISI ""TERSEBUT"" . ????.
.
hampir seluruh surabaya PKL dRAPIKAN DGUSUR pindah ngalor ngidul... COBA SAMPEAN KL JALAN TENGOK KANAN KIRI BERAPA PKL YG JUALAN DI PINGGIR, ATAS SALURAN... G TERHITUNG PAK, GAK CUMA PULUHAN, RIBUAAAAAAAN PKL.... KALAU SMUA DGUSUR PINDAH NGALOR NGIDUL DITERTIBKAN JUGA... sementara PEMERINTAHE BUKANNYA NGOPENI NGAYOMI EKONOMI PENGHIDUPAN rakyat kecil malah... NAUDZUBILLAH.. #SAMPEAN MBAKULO PAK, biar ROSO ROSO EMPATI dadi wong cilik SUSAH GOLEKNPENGURIPAN NEK TANAH NEGOROE DEWE....
.
#nerapno TITIPAN AMANAH ADIL buat semua kalangan rakyat kuwi BERAT #HISABNYA",2026-05-18T02:59:10.000Z,2026-06-06T05:19:29Z,Q_9f6ebc640342,new,true
2091a400c464db3b8e0098d7755a11cb32843df80b955792f84678e2152bae19,18095003528171570,2f707fd89716c7f5516c804ea54c3f65420c28b778379942d446e535804927d8,https://www.instagram.com/p/DXYQ7_Jj0eZ/,DXYQ7_Jj0eZ,@ericahyadi_,Parkir di makam keputih meresahkan pak.,2026-04-27T16:08:07.000Z,2026-06-06T05:19:52Z,Q_db96a35b664c,new,true
7272240b6e0d80f4b6f5e6ca1d4db7877a77c70f18305e501f2533baea06e80d,18068026280461894,2f707fd89716c7f5516c804ea54c3f65420c28b778379942d446e535804927d8,https://www.instagram.com/p/DXYQ7_Jj0eZ/,DXYQ7_Jj0eZ,@ericahyadi_,Siap,2026-04-25T12:24:20.000Z,2026-06-06T05:19:52Z,Q_db96a35b664c,new,true
f5f5667b66b8eb07276ead80478e70e2e7b41a58f80f8feaf7180be3661be12e,17933918433246873,2f707fd89716c7f5516c804ea54c3f65420c28b778379942d446e535804927d8,https://www.instagram.com/p/DXYQ7_Jj0eZ/,DXYQ7_Jj0eZ,@ericahyadi_,Cak mbok di cek pok o kampung ku mosok lampu  PJU kampung mati wes lapor gak di reken,2026-04-25T11:47:51.000Z,2026-06-06T05:19:52Z,Q_db96a35b664c,new,true
a492b2c91a86dfde1a269fa810b9b09bb5b6722e5c2d249cf222802bdbf38c53,18015029945684219,2f707fd89716c7f5516c804ea54c3f65420c28b778379942d446e535804927d8,https://www.instagram.com/p/DXYQ7_Jj0eZ/,DXYQ7_Jj0eZ,@ericahyadi_,SEMANGAT  TERUS.......BAPAK  WALIKOTA,2026-04-24T01:45:30.000Z,2026-06-06T05:19:52Z,Q_db96a35b664c,new,true
f0309b97e70e4310d43ce1c5bae349be14c69b31e2650fdb2e816908c536abc6,18127803724515956,2f707fd89716c7f5516c804ea54c3f65420c28b778379942d446e535804927d8,https://www.instagram.com/p/DXYQ7_Jj0eZ/,DXYQ7_Jj0eZ,@ericahyadi_,Ok,2026-04-23T07:06:54.000Z,2026-06-06T05:19:52Z,Q_db96a35b664c,new,true
c94a9a79c27ba806381bdfe0dfe0a6f7e79e35a3a4437186548e7f45650006a4,18114925975686288,2f707fd89716c7f5516c804ea54c3f65420c28b778379942d446e535804927d8,https://www.instagram.com/p/DXYQ7_Jj0eZ/,DXYQ7_Jj0eZ,@ericahyadi_,Pak kalisumo bratang pak tolong sampean cek,2026-04-23T00:50:02.000Z,2026-06-06T05:19:52Z,Q_db96a35b664c,new,true
823fadbfe8c5930a5561143e5ce52eda4937710e7e184f908b39f2d340224ef4,18100010620991458,2f707fd89716c7f5516c804ea54c3f65420c28b778379942d446e535804927d8,https://www.instagram.com/p/DXYQ7_Jj0eZ/,DXYQ7_Jj0eZ,@ericahyadi_,cak eri....jalan utama HR muhammad - jonosewoyo kampus unisa mulai unta belum bungkuk sampek sekarang kok gak di aspal ? katanya daerah elit tapi jalan sulit cak,2026-04-22T08:50:54.000Z,2026-06-06T05:19:52Z,Q_db96a35b664c,new,true
5e624c523f775426462bcdb993bc4d4d615f1123f440868baf801edfab7803ed,17985360191989103,2f707fd89716c7f5516c804ea54c3f65420c28b778379942d446e535804927d8,https://www.instagram.com/p/DXYQ7_Jj0eZ/,DXYQ7_Jj0eZ,@ericahyadi_,"Motong besi pinggir dalan, pojok an sebelah lor cedek jembatan arah tambah deres, ku mbarahi dalan nan sempit. Ditambah parkir kendaraan sak enak e, koyok sing nduwe dalan ae.",2026-04-22T08:31:48.000Z,2026-06-06T05:19:52Z,Q_db96a35b664c,new,true
86ddf5dda64f1ae5af129181e107d052485723052b0120b5dabddc93159d4c62,18055138340729049,2f707fd89716c7f5516c804ea54c3f65420c28b778379942d446e535804927d8,https://www.instagram.com/p/DXYQ7_Jj0eZ/,DXYQ7_Jj0eZ,@ericahyadi_,salam sehat dan sukses selalu tetap semangat jadi orang baik Cak Erick,2026-04-21T23:41:40.000Z,2026-06-06T05:19:52Z,Q_db96a35b664c,new,true
8cbd1cf8b8f8e9ee5a515771a570485b885643d127ab33231e99ade828c4bcdf,17887142454471387,2f707fd89716c7f5516c804ea54c3f65420c28b778379942d446e535804927d8,https://www.instagram.com/p/DXYQ7_Jj0eZ/,DXYQ7_Jj0eZ,@ericahyadi_,❤️❤️❤️,2026-04-21T22:42:46.000Z,2026-06-06T05:19:52Z,Q_db96a35b664c,new,true
580fa2ab90aaca0f5909feb2b48261a9e0294bd83eaa1c63c6671ba27bce6e2b,18094343303166308,2f707fd89716c7f5516c804ea54c3f65420c28b778379942d446e535804927d8,https://www.instagram.com/p/DXYQ7_Jj0eZ/,DXYQ7_Jj0eZ,@ericahyadi_,"Lanjutkan ...klau SDH penataan kota SBY klau Bsa d pantau ,lurah,camat,satpol pp...",2026-04-21T12:44:19.000Z,2026-06-06T05:19:52Z,Q_db96a35b664c,new,true
362a9b7970103c855e0fa820c42f287e292c0e624e8ccb23aeced0aa2a5d0d0c,17881776222549847,2f707fd89716c7f5516c804ea54c3f65420c28b778379942d446e535804927d8,https://www.instagram.com/p/DXYQ7_Jj0eZ/,DXYQ7_Jj0eZ,@ericahyadi_,Kalitebu ?  Dimana itu ?,2026-04-21T10:27:25.000Z,2026-06-06T05:19:52Z,Q_db96a35b664c,new,true
bb03641d270120a678f93e3a1b2f47667a84865dc120d0617ed307366aa784d7,18320466595270564,2f707fd89716c7f5516c804ea54c3f65420c28b778379942d446e535804927d8,https://www.instagram.com/p/DXYQ7_Jj0eZ/,DXYQ7_Jj0eZ,@ericahyadi_,Semoga selalu sehat sehat Pak Eri  terbaik 👍💯,2026-04-21T08:50:43.000Z,2026-06-06T05:19:52Z,Q_db96a35b664c,new,true
d93ad8d7584189fa473f9321309763b28fda51a5e3b2d8c9d6c8e60833f607f0,17959769679097816,2f707fd89716c7f5516c804ea54c3f65420c28b778379942d446e535804927d8,https://www.instagram.com/p/DXYQ7_Jj0eZ/,DXYQ7_Jj0eZ,@ericahyadi_,Hooooiiii pungli n lapak liar jl kyai Abdul Karim Rungkut menanggal piye???pajak e warga bukan utk oknum. Tp utk pembangunan kota yokk,2026-04-21T08:08:10.000Z,2026-06-06T05:19:52Z,Q_db96a35b664c,new,true
31e5b35673587cdfd02cf93114767f2a01b0846f4420ab875f982e41d588bc3a,17959325163107692,2f707fd89716c7f5516c804ea54c3f65420c28b778379942d446e535804927d8,https://www.instagram.com/p/DXYQ7_Jj0eZ/,DXYQ7_Jj0eZ,@ericahyadi_,Loh onok Pak Fikser,2026-04-21T06:00:40.000Z,2026-06-06T05:19:52Z,Q_db96a35b664c,new,true
02af341170cb8a8a09661fab052142e508113691bdc1a99f48f5d5ac867d9be2,17942473791178217,d074a05178a8fafa76de9c49b54f4e0691ff31f7db437e07aa1a24e5b738de7d,https://www.instagram.com/p/DXYYkRdj9Gs/,DXYYkRdj9Gs,@ericahyadi_,Njaluk perhatianè Cak Wali..sampah bungkus plastik kresek dibuang sembarangan.... staf pean sidak ... supoyo weruh..,2026-04-24T13:32:16.000Z,2026-06-06T05:20:09Z,Q_651b797d2971,new,true
f5c8094d3cc496ef60d10d5f1eb00ce3ec81ad33d2b1e11fd1be57dce3864140,17921782677339263,d074a05178a8fafa76de9c49b54f4e0691ff31f7db437e07aa1a24e5b738de7d,https://www.instagram.com/p/DXYYkRdj9Gs/,DXYYkRdj9Gs,@ericahyadi_,Siang pak Saya minta tolong mobil satpol PP jangan di parkir depan posko nya krn tadi buat macet jalan sekitar jam 5 sore tgl 23 april 2026 bongkar pasar maling wonokromo surabaya,2026-04-24T02:51:47.000Z,2026-06-06T05:20:09Z,Q_651b797d2971,new,true
bfdbc495bad81864d14ac3b209b6dabf6a730ce4ae7f7f873c68e3f32c86beaf,18440330398115184,d074a05178a8fafa76de9c49b54f4e0691ff31f7db437e07aa1a24e5b738de7d,https://www.instagram.com/p/DXYYkRdj9Gs/,DXYYkRdj9Gs,@ericahyadi_,Jalan OER kapan pak ? 🙏@ericahyadi_,2026-04-23T11:18:33.000Z,2026-06-06T05:20:09Z,Q_651b797d2971,new,true
fd66693702db4d73ca9b55596a1da36898ac145bac0f5b910ea61b23debee267,18106564264902304,d074a05178a8fafa76de9c49b54f4e0691ff31f7db437e07aa1a24e5b738de7d,https://www.instagram.com/p/DXYYkRdj9Gs/,DXYYkRdj9Gs,@ericahyadi_,MANTAP MAKASIH YA WALIJUKIR,2026-04-22T23:40:48.000Z,2026-06-06T05:20:09Z,Q_651b797d2971,new,true
1353eda0f9a08f3af64340e2c054b2bf7af3776c327496edd1ca8d3db2ef3961,18110250451860773,d074a05178a8fafa76de9c49b54f4e0691ff31f7db437e07aa1a24e5b738de7d,https://www.instagram.com/p/DXYYkRdj9Gs/,DXYYkRdj9Gs,@ericahyadi_,Ayo  CAK @ericahyadi_  WAYAE BIKIN KOTA KELAHIRAN SAYA SEBAGUS MUNGKIN ....YANG MANA HARUS DIBENERIN.... WAYAE WAYAE.....,2026-04-22T05:52:26.000Z,2026-06-06T05:20:09Z,Q_651b797d2971,new,true
d89d39ced794b67a5d47c63534b56f130ec05767a9dcb510b742321ba76580db,17926073763278845,d074a05178a8fafa76de9c49b54f4e0691ff31f7db437e07aa1a24e5b738de7d,https://www.instagram.com/p/DXYYkRdj9Gs/,DXYYkRdj9Gs,@ericahyadi_,Hp ku amoh ta iki layare?,2026-04-22T03:33:23.000Z,2026-06-06T05:20:09Z,Q_651b797d2971,new,true
ae35b61a39552a4f35936a929da28879d083cc1f62b5bf961876f29248e8ab94,18106071307725762,d074a05178a8fafa76de9c49b54f4e0691ff31f7db437e07aa1a24e5b738de7d,https://www.instagram.com/p/DXYYkRdj9Gs/,DXYYkRdj9Gs,@ericahyadi_,"Pokok sering mudok ng warga warga ng ndalan Pak wali dkk, pasti warga seneng",2026-04-22T01:10:28.000Z,2026-06-06T05:20:09Z,Q_651b797d2971,new,true
7279c3497b3c14518fa3722d538192e744679df3e24e01008e4bae2377359da0,17871572718487118,d074a05178a8fafa76de9c49b54f4e0691ff31f7db437e07aa1a24e5b738de7d,https://www.instagram.com/p/DXYYkRdj9Gs/,DXYYkRdj9Gs,@ericahyadi_,gass puool Cak Erick salam sehat dan sukses selalu,2026-04-21T23:34:06.000Z,2026-06-06T05:20:09Z,Q_651b797d2971,new,true
3297e01aec7bc90c890c44edcc81256abcb025ef1efa62790f24da660fa07006,18043322990773800,d074a05178a8fafa76de9c49b54f4e0691ff31f7db437e07aa1a24e5b738de7d,https://www.instagram.com/p/DXYYkRdj9Gs/,DXYYkRdj9Gs,@ericahyadi_,🔥,2026-04-21T15:01:45.000Z,2026-06-06T05:20:09Z,Q_651b797d2971,new,true
07f6b287a57ba21a573e977e8e55b849ae94c7ce6be4d0e6327efcb42b3950bd,18102620476763776,d074a05178a8fafa76de9c49b54f4e0691ff31f7db437e07aa1a24e5b738de7d,https://www.instagram.com/p/DXYYkRdj9Gs/,DXYYkRdj9Gs,@ericahyadi_,Fungsikan  kembali jadi jalan pak. Baik siang maupun malam. Pemecah kemacetan sekitar ngagel dan jagir,2026-04-21T12:10:05.000Z,2026-06-06T05:20:09Z,Q_651b797d2971,new,true
7a4d534967ec6a4d24a1950549843fe9b5225077e9e9f93bff48b0f0537ca27d,18102932773760428,d074a05178a8fafa76de9c49b54f4e0691ff31f7db437e07aa1a24e5b738de7d,https://www.instagram.com/p/DXYYkRdj9Gs/,DXYYkRdj9Gs,@ericahyadi_,Gempur cak Ery biyar gak kumuhvsby,2026-04-21T11:47:57.000Z,2026-06-06T05:20:09Z,Q_651b797d2971,new,true
