comment_id_hash,comment_id,post_id_hash,post_url,post_shortcode,source_account,comment_text,comment_created_at,scraped_at,queue_id,scraping_status,is_baseline
55a127f2982606025e8f01634f9776e7e5be4f92dc982cb086402d2d671ed31e,18101565770282206,24e2cb97f630e114c37c68a999979278aaf46fb770c7c6cf02ffca2632f523a2,https://www.instagram.com/p/DX31S0Xyh6t/,DX31S0Xyh6t,@cakj1,"Gak kaget aku parkir liar Saiki di jelajah i Karo Duro Kabeh gak nak Indomaret, Alfamart nak ATM pun AE Yoo di jogo parkir liar ancen nemen kok kalangan meduro iku",2026-05-13T17:12:37.000Z,2026-06-06T05:27:19Z,Q_784454b8ab72,new,true
bc9aa1e641eefcb34871924a752852be26649376b635e005395cffb74aa7a6ca,18106352647931664,24e2cb97f630e114c37c68a999979278aaf46fb770c7c6cf02ffca2632f523a2,https://www.instagram.com/p/DX31S0Xyh6t/,DX31S0Xyh6t,@cakj1,"Kurang ajar... Nguawurrr kang parkir e isone ""Arek Mulet Pakisaji"" Jarene @cakj1  kabyuuukkk ae 🤣🤣",2026-05-11T05:52:53.000Z,2026-06-06T05:27:19Z,Q_784454b8ab72,new,true
81e038c69bed7b44720909529ff2bc5f0fde3bff0dfd15234fa1aba24b111417,18080548469290345,24e2cb97f630e114c37c68a999979278aaf46fb770c7c6cf02ffca2632f523a2,https://www.instagram.com/p/DX31S0Xyh6t/,DX31S0Xyh6t,@cakj1,Lho gak ge helm ta cak @cakj1 lak malah di jauk i duwek karo seng sragaman ngko,2026-05-11T03:33:00.000Z,2026-06-06T05:27:19Z,Q_784454b8ab72,new,true
f457fca9b5f1b7e04d0c09f3b7cf992b4e0ac7bf3944872011e468b3f640d847,18592406503035526,24e2cb97f630e114c37c68a999979278aaf46fb770c7c6cf02ffca2632f523a2,https://www.instagram.com/p/DX31S0Xyh6t/,DX31S0Xyh6t,@cakj1,🤣🤣🤣 nek nyeluk 😂,2026-05-10T13:36:12.000Z,2026-06-06T05:27:19Z,Q_784454b8ab72,new,true
8f7df90e08c6300601662a2b4e5efebaf34cab75bd9c220c1cd745163f5ef1e1,18103627936949154,24e2cb97f630e114c37c68a999979278aaf46fb770c7c6cf02ffca2632f523a2,https://www.instagram.com/p/DX31S0Xyh6t/,DX31S0Xyh6t,@cakj1,🤣🤣🤣🤣ji jii duek mu ji,2026-05-10T07:21:29.000Z,2026-06-06T05:27:19Z,Q_784454b8ab72,new,true
7216bfa29af7ca4c8ce6f065ce93f47fdab401c314bc8ada46b7a8ade4068778,18109265335915528,24e2cb97f630e114c37c68a999979278aaf46fb770c7c6cf02ffca2632f523a2,https://www.instagram.com/p/DX31S0Xyh6t/,DX31S0Xyh6t,@cakj1,😂,2026-05-09T13:44:48.000Z,2026-06-06T05:27:19Z,Q_784454b8ab72,new,true
30fe803ebe66778136f48761c206a75430cb1a6830ce889610528e34f61ee1f7,17861135178631383,24e2cb97f630e114c37c68a999979278aaf46fb770c7c6cf02ffca2632f523a2,https://www.instagram.com/p/DX31S0Xyh6t/,DX31S0Xyh6t,@cakj1,Ji ji duwek mu ji.. matane.. 🤣,2026-05-09T01:23:44.000Z,2026-06-06T05:27:19Z,Q_784454b8ab72,new,true
9da18a57a9e6242683f41198ab6b1965609e9bf8e903ebf108d9638f413943e0,18081923009134443,cf5e4b9bfc32ac31b5549bad8b162d43543e024053f73ec008e0f208c1a210a7,https://www.instagram.com/p/DXoRm8xSKZZ/,DXoRm8xSKZZ,@cakj1,RT nya kok Melihatan gugup kayak Ketakutan ya kenapa pak .,2026-05-09T02:14:40.000Z,2026-06-06T05:27:33Z,Q_b8415195cd74,new,true
ff57af0b30cd0e060f51de32299144642eaaf028ce104326c37bc41152f5f368,18093672104181135,cf5e4b9bfc32ac31b5549bad8b162d43543e024053f73ec008e0f208c1a210a7,https://www.instagram.com/p/DXoRm8xSKZZ/,DXoRm8xSKZZ,@cakj1,Intine opo hasile?,2026-05-06T00:31:19.000Z,2026-06-06T05:27:33Z,Q_b8415195cd74,new,true
68b120f22b8fb6bd58eda27b85f075bc2b35c04d9033670900466b59864806a3,17861144880628835,cf5e4b9bfc32ac31b5549bad8b162d43543e024053f73ec008e0f208c1a210a7,https://www.instagram.com/p/DXoRm8xSKZZ/,DXoRm8xSKZZ,@cakj1,Saya juga mau melaporkan arma gemol jajar tunggal wiyung kasus penipuan lowongan kerja bayar admin outsourching dan pengelapan barang,2026-04-28T16:06:17.000Z,2026-06-06T05:27:33Z,Q_b8415195cd74,new,true
7b9d1e7eddde05a01446096e93f2a59930771ed84a1e355dbca3e7505d53fc57,18100619684296358,cf5e4b9bfc32ac31b5549bad8b162d43543e024053f73ec008e0f208c1a210a7,https://www.instagram.com/p/DXoRm8xSKZZ/,DXoRm8xSKZZ,@cakj1,"Jangan menggampangkan masalah pak....fokus aja sama ancaman buat si ibuk, dia perempuan yang mesti dilindungi",2026-04-28T12:44:09.000Z,2026-06-06T05:27:33Z,Q_b8415195cd74,new,true
17ebb040c174d05f174716e11fc85ac557e65ade95261140d4395ae7a3f90334,18082360409614129,cf5e4b9bfc32ac31b5549bad8b162d43543e024053f73ec008e0f208c1a210a7,https://www.instagram.com/p/DXoRm8xSKZZ/,DXoRm8xSKZZ,@cakj1,"Assalamualaikum Bapak @cakj1 Mohon maaf klw saya lancang mungkin Uda jalan tuhan  lewat perantara bapak bisa bantu saya buat Nebus obat adek dan beli makan. saya bingung harus kemana lagi pak, mau ngadu ke orang tua saya Uda meninggal keduanya, semoga lewat perantara bapak bisa bantu saya demi tuhan saya ngomong jujur dan apa adanya, no rek (571401038097530 bri) saya mau jual hp cuman di tawar 50ribu pak hp model lama Samsung J2 saya Uda nggak punya apa apa lagi pak, saya mohon dengan sangat bantu saya pak 😢",2026-04-28T06:24:22.000Z,2026-06-06T05:27:33Z,Q_b8415195cd74,new,true
b40798731fb0022aa55e3f50f3ccd769e43c00c24c75a9efea794382bf6d886e,18083149712096730,cf5e4b9bfc32ac31b5549bad8b162d43543e024053f73ec008e0f208c1a210a7,https://www.instagram.com/p/DXoRm8xSKZZ/,DXoRm8xSKZZ,@cakj1,Kembang kuning endi iku....,2026-04-28T05:31:09.000Z,2026-06-06T05:27:33Z,Q_b8415195cd74,new,true
e7199a588b4d62451223821ebbdd349238b34801c4aeb6e78316c70e2c4a49bb,18110530555827628,cf5e4b9bfc32ac31b5549bad8b162d43543e024053f73ec008e0f208c1a210a7,https://www.instagram.com/p/DXoRm8xSKZZ/,DXoRm8xSKZZ,@cakj1,Lurahe mumeeet iku pak ISO ga teko padahal pimpinan tertinggi kota WIS teko,2026-04-28T02:15:15.000Z,2026-06-06T05:27:33Z,Q_b8415195cd74,new,true
9ac2257bdcdb1a18afd641509617e4988f758fd812bde1c7aeda54bb6b02db6c,18161962819382482,cf5e4b9bfc32ac31b5549bad8b162d43543e024053f73ec008e0f208c1a210a7,https://www.instagram.com/p/DXoRm8xSKZZ/,DXoRm8xSKZZ,@cakj1,Kek mana closet diatas got😢 apa gak ada lahan lagi ?😢😢😢,2026-04-27T13:09:55.000Z,2026-06-06T05:27:33Z,Q_b8415195cd74,new,true
aa4ad494608ba859d6fbdf8d2c6ebbd37214b9f443521cb4b72d27a09f5a8cf4,18151969210466203,cf5e4b9bfc32ac31b5549bad8b162d43543e024053f73ec008e0f208c1a210a7,https://www.instagram.com/p/DXoRm8xSKZZ/,DXoRm8xSKZZ,@cakj1,Kq bisa closet langsung ke got,2026-04-27T11:22:29.000Z,2026-06-06T05:27:33Z,Q_b8415195cd74,new,true
8e67fc563093759a205e2cc36367872ee08eee006e2c6c0801f15f9ec4c8242b,18089902742055231,cf5e4b9bfc32ac31b5549bad8b162d43543e024053f73ec008e0f208c1a210a7,https://www.instagram.com/p/DXoRm8xSKZZ/,DXoRm8xSKZZ,@cakj1,"Nk ngancam bunuh, bunuh dewe ae skdrge dibunuh, nyewo wong gae bunuh😂",2026-04-27T11:17:22.000Z,2026-06-06T05:27:33Z,Q_b8415195cd74,new,true
0ee416bfd1b9e370e84c25cb73b47bf13ba3902527d86794a1de4a7268a47eae,18546808774070684,cf5e4b9bfc32ac31b5549bad8b162d43543e024053f73ec008e0f208c1a210a7,https://www.instagram.com/p/DXoRm8xSKZZ/,DXoRm8xSKZZ,@cakj1,.lha sapeting Nok atas got py ambune kok ORA mikir,2026-04-27T11:05:43.000Z,2026-06-06T05:27:33Z,Q_b8415195cd74,new,true
2914bdb7ad58819f337fa2d3d3b509342408f83c8ad4e4dbf990fcf07a9e9313,17860503204686062,cf5e4b9bfc32ac31b5549bad8b162d43543e024053f73ec008e0f208c1a210a7,https://www.instagram.com/p/DXoRm8xSKZZ/,DXoRm8xSKZZ,@cakj1,Bagaimana cara ketemu cak ji Lur,2026-04-27T11:05:35.000Z,2026-06-06T05:27:33Z,Q_b8415195cd74,new,true
ec1da783b0b9213a6603df38c104950a5629478d654525bc263161fb6414b035,18422961775120286,cf5e4b9bfc32ac31b5549bad8b162d43543e024053f73ec008e0f208c1a210a7,https://www.instagram.com/p/DXoRm8xSKZZ/,DXoRm8xSKZZ,@cakj1,Septitank umum,2026-04-27T09:48:20.000Z,2026-06-06T05:27:33Z,Q_b8415195cd74,new,true
07a8dbbaf3dbe8741dd83cfd8f3b1b1991f8da9fea728a51c148e469ccd7243d,18099539345084646,cf5e4b9bfc32ac31b5549bad8b162d43543e024053f73ec008e0f208c1a210a7,https://www.instagram.com/p/DXoRm8xSKZZ/,DXoRm8xSKZZ,@cakj1,Lurah sak suroboyo suibuk kbh nek ono cak ji,2026-04-27T09:41:08.000Z,2026-06-06T05:27:33Z,Q_b8415195cd74,new,true
5ec9b74879cafb943893d66879a9e5304a90c2b2732f294f2ff79d6d126aeff8,18037297121595892,cf5e4b9bfc32ac31b5549bad8b162d43543e024053f73ec008e0f208c1a210a7,https://www.instagram.com/p/DXoRm8xSKZZ/,DXoRm8xSKZZ,@cakj1,"waduh kok isok mgancan bunuh""",2026-04-27T09:25:48.000Z,2026-06-06T05:27:33Z,Q_b8415195cd74,new,true
4be8e7c0980e97d8f8c9cc0389519b7c404708a40d768e72084f3ec0fcfbdabe,18125591587613562,9ba38b370d83359d234506cbfc74eb9ed96312d14decdebf1de5bffe5a99a8d0,https://www.instagram.com/p/DXvTZxrSPvH/,DXvTZxrSPvH,@cakj1,SEHAT SELALU CAK JI...SEMOGA ALLAH SWT SELALU MEMBERIKAN KEBERKAHAN KESEHATAN DAN KEBERKAHAN JABATAN YG AMANAH...,2026-05-13T10:14:43.000Z,2026-06-06T05:27:42Z,Q_2be9f4383608,new,true
db2f00af2ec376175040bb76968a9b5189d76e28e838263bbd4ecaa6c65949c0,18127397995521779,9ba38b370d83359d234506cbfc74eb9ed96312d14decdebf1de5bffe5a99a8d0,https://www.instagram.com/p/DXvTZxrSPvH/,DXvTZxrSPvH,@cakj1,Cak Ji❤️❤️❤️❤️❤️,2026-05-07T04:06:14.000Z,2026-06-06T05:27:42Z,Q_2be9f4383608,new,true
f98407dfc2e174921372a2a18dc5d862e16eac3bb8381f2a49707f3588c183f3,18414157828178477,9ba38b370d83359d234506cbfc74eb9ed96312d14decdebf1de5bffe5a99a8d0,https://www.instagram.com/p/DXvTZxrSPvH/,DXvTZxrSPvH,@cakj1,Pak  tolong dong tindakan ke pdam.. Laporan bbrp kali ke pdam tpi gak ada hasil.. Air pdam saya sdh hampir 2bulan nyala mati. Dan nyalanya itu selalu malam saja skg. Jam 12 kdg jam 1 malam baru nyala nnti jam 3 pagi sudah ga keluar air.. Tiap hari begitu.. Kadang kerja sampai gak mandi karna gak ada air.. Saya jg bayar pdam gapernah telat tapi air susah sekali..,2026-05-03T13:12:20.000Z,2026-06-06T05:27:42Z,Q_2be9f4383608,new,true
a09f1760b97ed0075129e4527d9cb33af9848e61b5f9807cbd896a5186bdd7fa,18078772232175452,9ba38b370d83359d234506cbfc74eb9ed96312d14decdebf1de5bffe5a99a8d0,https://www.instagram.com/p/DXvTZxrSPvH/,DXvTZxrSPvH,@cakj1,Cak ji mohon maaf ijin kalau terjun ke lapangan tolong dong di ajak @khofifah.ip biar tau dunia luar,2026-05-01T01:34:08.000Z,2026-06-06T05:27:42Z,Q_2be9f4383608,new,true
1b5224dacfa3db03ed6b7813fd32800158fca482726e4d1080801bff9bd5e5eb,18071750066310163,9ba38b370d83359d234506cbfc74eb9ed96312d14decdebf1de5bffe5a99a8d0,https://www.instagram.com/p/DXvTZxrSPvH/,DXvTZxrSPvH,@cakj1,"Kalo @cakj1 teko berarti iki nyata di kerjakno,tp nek seng teko walikonten wahhh asli seng ngelas cm epok2 tok",2026-04-30T21:19:33.000Z,2026-06-06T05:27:42Z,Q_2be9f4383608,new,true
72d4e9b9fc4a9e1d97337c77f05bad3309f023d6039508a1b3b0bc7ce51ac2a3,18099673070102503,9ba38b370d83359d234506cbfc74eb9ed96312d14decdebf1de5bffe5a99a8d0,https://www.instagram.com/p/DXvTZxrSPvH/,DXvTZxrSPvH,@cakj1,"Alhamdulillah, sudah selesai di tempat saya masih belum keluar kedung cowek, stok nya udah hampir habis😢😢",2026-04-30T18:09:09.000Z,2026-06-06T05:27:42Z,Q_2be9f4383608,new,true
409fbdde9de76e398ce45aed8a8f13caac18b480da372ffc0e7af853ee2901d8,17873771988599582,9ba38b370d83359d234506cbfc74eb9ed96312d14decdebf1de5bffe5a99a8d0,https://www.instagram.com/p/DXvTZxrSPvH/,DXvTZxrSPvH,@cakj1,Terima kasih Bapak Armuji dan PDAM sudah normal kembali 👏👏👏,2026-04-30T14:09:17.000Z,2026-06-06T05:27:42Z,Q_2be9f4383608,new,true
830542df5dd7ec9dc6ea6ce7018fbfbbffebbbb2644c9710a38eddfa35ba5b75,18049919351742375,9ba38b370d83359d234506cbfc74eb9ed96312d14decdebf1de5bffe5a99a8d0,https://www.instagram.com/p/DXvTZxrSPvH/,DXvTZxrSPvH,@cakj1,semolowaru elok alirannya masih kecil kalo waktu pagi jam 7 keatas mati sama sore pak,2026-04-30T13:23:09.000Z,2026-06-06T05:27:42Z,Q_2be9f4383608,new,true
14d714fdd67738de681e1890cfc6813e0d2e608f0a3a4fb4bb83a584a1adab91,17924315184294599,9ba38b370d83359d234506cbfc74eb9ed96312d14decdebf1de5bffe5a99a8d0,https://www.instagram.com/p/DXvTZxrSPvH/,DXvTZxrSPvH,@cakj1,🙏🙏🏆🏆🇮🇩🇮🇩🇮🇩 # trimakasih # PDAM  Rungkut mapan aman terkendali,2026-04-30T13:10:33.000Z,2026-06-06T05:27:42Z,Q_2be9f4383608,new,true
63d9c305406c26e44d5b0c4a7e894dc4e937471d14a8c0f1e2fb2b80920af90f,18005014856914385,9ba38b370d83359d234506cbfc74eb9ed96312d14decdebf1de5bffe5a99a8d0,https://www.instagram.com/p/DXvTZxrSPvH/,DXvTZxrSPvH,@cakj1,Ndiii cak kelurahan penjaringan jek matiii🙌🙌😂 wes sedino loh,2026-04-30T12:42:17.000Z,2026-06-06T05:27:42Z,Q_2be9f4383608,new,true
ac80292d4076f7fcf406e6134d2b29f1ec55dedc2bf27baa81d9c4a8b8dd5655,17929962036085906,9ba38b370d83359d234506cbfc74eb9ed96312d14decdebf1de5bffe5a99a8d0,https://www.instagram.com/p/DXvTZxrSPvH/,DXvTZxrSPvH,@cakj1,Nirwana eksekutif blum ngalir,2026-04-30T12:21:16.000Z,2026-06-06T05:27:42Z,Q_2be9f4383608,new,true
0fef8c19524e3d95b5ece4d9734fe62a385594251d17279ce1ad1210444a1194,18007357940878950,9ba38b370d83359d234506cbfc74eb9ed96312d14decdebf1de5bffe5a99a8d0,https://www.instagram.com/p/DXvTZxrSPvH/,DXvTZxrSPvH,@cakj1,Lokasi lebak masih belum stabil kadang nyala kadang mati barusan nyalanya,2026-04-30T12:08:00.000Z,2026-06-06T05:27:42Z,Q_2be9f4383608,new,true
4becfef5aef2f81f44b45f20d7bc84e5ba0dca544d0246f92fa6fa7e10817de7,17997352877762302,9ba38b370d83359d234506cbfc74eb9ed96312d14decdebf1de5bffe5a99a8d0,https://www.instagram.com/p/DXvTZxrSPvH/,DXvTZxrSPvH,@cakj1,Pakk sampek skrng masih mati airnyaa,2026-04-30T11:59:14.000Z,2026-06-06T05:27:42Z,Q_2be9f4383608,new,true
49310a3885b1ec975195c1a59612c7cb798c2d70a07548bf50d3f9ec19776b60,17950747785134318,9ba38b370d83359d234506cbfc74eb9ed96312d14decdebf1de5bffe5a99a8d0,https://www.instagram.com/p/DXvTZxrSPvH/,DXvTZxrSPvH,@cakj1,GGMU cak Ji @cakj1 😂,2026-04-30T11:32:18.000Z,2026-06-06T05:27:42Z,Q_2be9f4383608,new,true
ec1892bd4071158da6d1362adec9048e7bf03378bb34a1bc2eae08384613cf97,17860736802582397,9ba38b370d83359d234506cbfc74eb9ed96312d14decdebf1de5bffe5a99a8d0,https://www.instagram.com/p/DXvTZxrSPvH/,DXvTZxrSPvH,@cakj1,Cakji air di kenjeran tambakderes belum nyala sampai sekarang 😭😭,2026-04-30T11:29:01.000Z,2026-06-06T05:27:42Z,Q_2be9f4383608,new,true
93495a480c37bd82d604300d6802cf3c034b3684a23bb202d7df3df4d755619e,18106065901942783,5991bbddd58f1018c3fe13ac6b5502941c9f9f16579a39db986569d66839f638,https://www.instagram.com/p/DYMgqOIRY4s/,DYMgqOIRY4s,@cakj1,"Ompreng setelah di cuci kalau bisa di open, supaya bakteri pd ompreng mati.",2026-05-20T04:51:32.000Z,2026-06-06T05:27:52Z,Q_397b9cb03c45,new,true
1771107994d07a0c3fc5517aaa6a8523a7986958bd6eb1d2a675a160c3213c4e,17968058628107147,5991bbddd58f1018c3fe13ac6b5502941c9f9f16579a39db986569d66839f638,https://www.instagram.com/p/DYMgqOIRY4s/,DYMgqOIRY4s,@cakj1,😂😂😂nunggu sampe negara bangkrut.... 😂😂,2026-05-20T04:04:12.000Z,2026-06-06T05:27:52Z,Q_397b9cb03c45,new,true
c010db960f7f809da13749cf9292f1c6b7a2941d536099041c4fe28f6e43e930,18089251451342682,5991bbddd58f1018c3fe13ac6b5502941c9f9f16579a39db986569d66839f638,https://www.instagram.com/p/DYMgqOIRY4s/,DYMgqOIRY4s,@cakj1,Speak up,2026-05-19T12:05:48.000Z,2026-06-06T05:27:52Z,Q_397b9cb03c45,new,true
2c5066f12a9e2fa51862c50940789ce8e906a04b67573781cab8e401643095d4,17988842579985551,5991bbddd58f1018c3fe13ac6b5502941c9f9f16579a39db986569d66839f638,https://www.instagram.com/p/DYMgqOIRY4s/,DYMgqOIRY4s,@cakj1,Lek blonjo tuku nak supermarket Bu..ojok nak pasar akeh seng BS an.wes biru2 daging di olah AE..jarene harus bpom..jadi harus ke supermarket dong..UMKM SJ blonjo nak supermarket sesuai kita foto yg memenuhi syarat.pokok bukan daging luar AE.aman..luwes aman maneh lgsg nak rumah pemotongan sapi.jagal .fresh..,2026-05-19T04:02:59.000Z,2026-06-06T05:27:52Z,Q_397b9cb03c45,new,true
af6fc69598307f8ccabd94e1297208ca902984a6cab4991ce171482472c425bd,18105883214484857,5991bbddd58f1018c3fe13ac6b5502941c9f9f16579a39db986569d66839f638,https://www.instagram.com/p/DYMgqOIRY4s/,DYMgqOIRY4s,@cakj1,Ya harus dipenjara biar ada efek jera....ketegasan pemerintah,2026-05-18T13:51:14.000Z,2026-06-06T05:27:52Z,Q_397b9cb03c45,new,true
12805af1688f0c0b47cf271da1ecf3d2c25902ea85c9bd944497d685ae41d126,17932675017258309,5991bbddd58f1018c3fe13ac6b5502941c9f9f16579a39db986569d66839f638,https://www.instagram.com/p/DYMgqOIRY4s/,DYMgqOIRY4s,@cakj1,Harus ada tindakan hukum nya agar ada efek jera.,2026-05-18T08:35:50.000Z,2026-06-06T05:27:52Z,Q_397b9cb03c45,new,true
4dba91be556cd98693d38975006769a5f4554975d16bc86920c3978129cd3677,18046930496535884,5991bbddd58f1018c3fe13ac6b5502941c9f9f16579a39db986569d66839f638,https://www.instagram.com/p/DYMgqOIRY4s/,DYMgqOIRY4s,@cakj1,Basi itu masak nya kurang tanek,2026-05-16T11:46:58.000Z,2026-06-06T05:27:52Z,Q_397b9cb03c45,new,true
fd21e50d0e00d5c617756828c7b163ed7dc09f66002527f5cdc39c58e416adce,18449476594112337,5991bbddd58f1018c3fe13ac6b5502941c9f9f16579a39db986569d66839f638,https://www.instagram.com/p/DYMgqOIRY4s/,DYMgqOIRY4s,@cakj1,,2026-05-15T01:58:07.000Z,2026-06-06T05:27:52Z,Q_397b9cb03c45,new,true
5ffcd69ad27f169e566e862db92980fb3e7f956c0dae9430fd7f025bc80a3c84,17861591724689139,5991bbddd58f1018c3fe13ac6b5502941c9f9f16579a39db986569d66839f638,https://www.instagram.com/p/DYMgqOIRY4s/,DYMgqOIRY4s,@cakj1,Kobisa jadi ka sppg? Monitoring mu ga berkompeten,2026-05-15T00:39:39.000Z,2026-06-06T05:27:52Z,Q_397b9cb03c45,new,true
e5e6e76f63c79a8d45084467afb8777988567d51bcb39a4b391ded42661a48c9,17998196744942197,5991bbddd58f1018c3fe13ac6b5502941c9f9f16579a39db986569d66839f638,https://www.instagram.com/p/DYMgqOIRY4s/,DYMgqOIRY4s,@cakj1,Dapurnya tidak bersih lho ... @cakj1 ayo yang gentle 🔥,2026-05-14T22:44:55.000Z,2026-06-06T05:27:52Z,Q_397b9cb03c45,new,true
52da8eabd624f6ecac92216efcabb7bd3998b7c424c3feac7e09dfbae980e3d6,18586259161019175,5991bbddd58f1018c3fe13ac6b5502941c9f9f16579a39db986569d66839f638,https://www.instagram.com/p/DYMgqOIRY4s/,DYMgqOIRY4s,@cakj1,Fokus hp ne iPhone 17 Pro Max  batine uwakeh pancen MBG iku,2026-05-14T22:30:13.000Z,2026-06-06T05:27:52Z,Q_397b9cb03c45,new,true
351418dddb05b7f6d78c9e1d64d705ec33fcafdf1341fbd636182fd8b11ad97e,17849682423695496,5991bbddd58f1018c3fe13ac6b5502941c9f9f16579a39db986569d66839f638,https://www.instagram.com/p/DYMgqOIRY4s/,DYMgqOIRY4s,@cakj1,🔥🔥,2026-05-13T23:36:48.000Z,2026-06-06T05:27:52Z,Q_397b9cb03c45,new,true
94859b1393ebcf44037431d7b0d264cc57b2f64e45535c434052ccfe72657fb5,18043914665563429,5991bbddd58f1018c3fe13ac6b5502941c9f9f16579a39db986569d66839f638,https://www.instagram.com/p/DYMgqOIRY4s/,DYMgqOIRY4s,@cakj1,yo opo cak ji. memenuhi syarat tekan ndi. standart e memenuhi syarat tekan ndi wong sertifikat laik higien sanitasi ae ra nduwe,2026-05-13T14:06:06.000Z,2026-06-06T05:27:52Z,Q_397b9cb03c45,new,true
5e9684d0b0c21e2abb9a2e817635e1f4dc164f798ecc8315dd29c2eb8af5d7e8,18402932938144350,5991bbddd58f1018c3fe13ac6b5502941c9f9f16579a39db986569d66839f638,https://www.instagram.com/p/DYMgqOIRY4s/,DYMgqOIRY4s,@cakj1,Wes ta lah... selama MBG gak di STOP TOTAL !!! Masalah keracunan akan terus berlanjut !!! Termasuk APBN juga pasti keracunan !!!,2026-05-13T08:50:16.000Z,2026-06-06T05:27:52Z,Q_397b9cb03c45,new,true
bb1714f4f4fc796929cbe037e4b50bff09f12162fdf805399e440829fa331479,18591522844011675,5991bbddd58f1018c3fe13ac6b5502941c9f9f16579a39db986569d66839f638,https://www.instagram.com/p/DYMgqOIRY4s/,DYMgqOIRY4s,@cakj1,"Bukannya sebelum di share ke beberapa sekolah harusnya ahli gizi mencicipi dulu masakan semuanya yaa? Mohon maaf pak karena ini kejadian di sekolah anak saya ,kemarin untungnya anak saya tidak memakan MBG nya ,tapi banyak sekali teman-temannya yang mual muntah dan dilarikan ke rumah sakit ,saya harap dilakukan tindak tegas atas kejadian seperti ini ,kalau memang seperti ini sudah tidak ada MBG aja kalau kaya gitu pak",2026-05-13T07:53:25.000Z,2026-06-06T05:27:52Z,Q_397b9cb03c45,new,true
a9f28250f010ad3aa478b5156491d8a59663e0056c46abeb38b7d15bd2331ae9,17902655355487917,33c4d3941d5cc891542a9a6080744676df8aae67b90c7dc3acbca9a783e964d4,https://www.instagram.com/p/DX6Z9LbROuE/,DX6Z9LbROuE,@cakj1,"Wadduuhh...pembayaran booth design di event otomotif juga belum terbayar smp skrg ±20jt.. Mgkin terbelit judol ato ""dipepet"" LC 😂😂😂🔥🔥",2026-05-26T04:02:46.000Z,2026-06-06T05:28:00Z,Q_86d19fe24618,new,true
6886db219bb977a4f4c53b118907d8d89df1d67d610aac7473f7902d63e98373,18091879439371957,33c4d3941d5cc891542a9a6080744676df8aae67b90c7dc3acbca9a783e964d4,https://www.instagram.com/p/DX6Z9LbROuE/,DX6Z9LbROuE,@cakj1,Suamiku juga korban dari EO 88 ini cakji.. suamiku vendor yg gak dibayar sama 88..cuman dijanjiin saja..memang maling itu cak ji tolong diusut itu cak ji si vito,2026-05-25T14:42:29.000Z,2026-06-06T05:28:00Z,Q_86d19fe24618,new,true
4c795021448ebaed0f9494cecd8bd2bd5f097e9861b6919f9988fa276b71b08c,18110216908905923,33c4d3941d5cc891542a9a6080744676df8aae67b90c7dc3acbca9a783e964d4,https://www.instagram.com/p/DX6Z9LbROuE/,DX6Z9LbROuE,@cakj1,Cocok lek kon bongko tooo,2026-05-22T07:33:15.000Z,2026-06-06T05:28:00Z,Q_86d19fe24618,new,true
e0c297e421ac170aaf3937d7511ffe71e33d816ca4d56ff543b3e7b427e47f00,18103247699285400,33c4d3941d5cc891542a9a6080744676df8aae67b90c7dc3acbca9a783e964d4,https://www.instagram.com/p/DX6Z9LbROuE/,DX6Z9LbROuE,@cakj1,@delapandelapanorganizer tolong dong,2026-05-20T04:11:18.000Z,2026-06-06T05:28:00Z,Q_86d19fe24618,new,true
437bfef7b3d93f3f49b74de8942b11babfd1358414c00f0ce36e0bba7575fb24,18028440347811528,33c4d3941d5cc891542a9a6080744676df8aae67b90c7dc3acbca9a783e964d4,https://www.instagram.com/p/DX6Z9LbROuE/,DX6Z9LbROuE,@cakj1,@delapandelapanorganizer kok gak bisa di tag yah….,2026-05-20T04:10:12.000Z,2026-06-06T05:28:00Z,Q_86d19fe24618,new,true
5095657c98b309a54e81a7923b0835d1ea3a1d07c021edcd87220d168d53c252,18095027426177331,33c4d3941d5cc891542a9a6080744676df8aae67b90c7dc3acbca9a783e964d4,https://www.instagram.com/p/DX6Z9LbROuE/,DX6Z9LbROuE,@cakj1,Mbak @dtkristiana aku ini cuma jualan pentol. Masak tega mbak pak Vito sama Umkm kayak kita ini,2026-05-20T04:08:54.000Z,2026-06-06T05:28:00Z,Q_86d19fe24618,new,true
c703e131263096c7b6e3fbd514b6ffc1eac574a01cb6ca3d88b28e61def355f9,18048506906758041,33c4d3941d5cc891542a9a6080744676df8aae67b90c7dc3acbca9a783e964d4,https://www.instagram.com/p/DX6Z9LbROuE/,DX6Z9LbROuE,@cakj1,Halo mbak @dtkristiana mbak tolong ya harapan saya cuma ke mbak lo sebagai orang terdekat nya pak Vito,2026-05-20T04:07:58.000Z,2026-06-06T05:28:00Z,Q_86d19fe24618,new,true
111842db8be2b26877d19f3dd32136ea7d49ff7e4a7077504f8fa6562e486f41,18116391379816632,33c4d3941d5cc891542a9a6080744676df8aae67b90c7dc3acbca9a783e964d4,https://www.instagram.com/p/DX6Z9LbROuE/,DX6Z9LbROuE,@cakj1,@dtkristiana tolong ya mbak di info pak Vito nya suruh lunasi refund sesuai perjanjian tertulis di materai.,2026-05-20T04:07:18.000Z,2026-06-06T05:28:00Z,Q_86d19fe24618,new,true
f8980d173c7775a9f02816316fd3ef8cd5aa500255f61b9770cb492a02e98158,18124704640715778,33c4d3941d5cc891542a9a6080744676df8aae67b90c7dc3acbca9a783e964d4,https://www.instagram.com/p/DX6Z9LbROuE/,DX6Z9LbROuE,@cakj1,Hei EO tolong cepetan ganti uang refund 50% sesuai perjanjian,2026-05-20T03:55:03.000Z,2026-06-06T05:28:00Z,Q_86d19fe24618,new,true
8c1db65c5c36a1c5a4c98b3c834f3a1255a15438981c31801407e5c9320caba4,18119086957678862,33c4d3941d5cc891542a9a6080744676df8aae67b90c7dc3acbca9a783e964d4,https://www.instagram.com/p/DX6Z9LbROuE/,DX6Z9LbROuE,@cakj1,Semoga segera beres 👍,2026-05-18T17:57:41.000Z,2026-06-06T05:28:00Z,Q_86d19fe24618,new,true
53054d3d0c5c03ee2c9ed8caae053ec7d294ccfbb82b984ebf7f93b704954116,17949666159169539,33c4d3941d5cc891542a9a6080744676df8aae67b90c7dc3acbca9a783e964d4,https://www.instagram.com/p/DX6Z9LbROuE/,DX6Z9LbROuE,@cakj1,EO 88,2026-05-18T06:09:51.000Z,2026-06-06T05:28:00Z,Q_86d19fe24618,new,true
ab6bf6f782b9f9f6ee6e554e2f5e76f7ff226ac6ae9777e4d6d02af00bd1c660,18080350832166157,33c4d3941d5cc891542a9a6080744676df8aae67b90c7dc3acbca9a783e964d4,https://www.instagram.com/p/DX6Z9LbROuE/,DX6Z9LbROuE,@cakj1,Gawe nyabu iku cak,2026-05-11T19:12:32.000Z,2026-06-06T05:28:00Z,Q_86d19fe24618,new,true
c60856f828a88e933e9e589049358595bd5330c90c41a6223879e71e0084ed0d,18046869782600664,33c4d3941d5cc891542a9a6080744676df8aae67b90c7dc3acbca9a783e964d4,https://www.instagram.com/p/DX6Z9LbROuE/,DX6Z9LbROuE,@cakj1,EQ gk benar cabut saja ijinnya dan penjarakan ae.......,2026-05-07T18:43:46.000Z,2026-06-06T05:28:00Z,Q_86d19fe24618,new,true
f4306c7caa287ba2fcffed8068f1f2ba340e19730bcd015f783e81baaee0dfd2,18042867881788668,33c4d3941d5cc891542a9a6080744676df8aae67b90c7dc3acbca9a783e964d4,https://www.instagram.com/p/DX6Z9LbROuE/,DX6Z9LbROuE,@cakj1,"Ngene iki garai event sepi, goro2 promotor model kyok arek iki",2026-05-06T14:31:59.000Z,2026-06-06T05:28:00Z,Q_86d19fe24618,new,true
1399eb612ffb4a6fc64c9e0f91ac180e6918a588ed8525dbda4c17300ebf9fd5,18102999683491679,33c4d3941d5cc891542a9a6080744676df8aae67b90c7dc3acbca9a783e964d4,https://www.instagram.com/p/DX6Z9LbROuE/,DX6Z9LbROuE,@cakj1,Akibat tergiur paketan murah,2026-05-06T07:54:35.000Z,2026-06-06T05:28:00Z,Q_86d19fe24618,new,true
854ed4f40905bd9d6231b70bd087b1133a1ce1827eda9c6c5b2d5816df55e712,18104590385314402,cdf7ee45ab1d13574779f4d702117bc990de4c113c5103660fb89a361909b852,https://www.instagram.com/p/DXtgXz2Ef_E/,DXtgXz2Ef_E,@cakj1,@rendika_fani_herwantara Gatot sopo iki sing di maksud,2026-05-09T07:10:15.000Z,2026-06-06T05:28:17Z,Q_69ea7d16fb08,new,true
20f29039f7958cf876adda7ca9b539b7b1b96b799befaa9a3fb37f247860015a,18002528816873205,cdf7ee45ab1d13574779f4d702117bc990de4c113c5103660fb89a361909b852,https://www.instagram.com/p/DXtgXz2Ef_E/,DXtgXz2Ef_E,@cakj1,"Seumpama @cakj1 membeli apertemen di Surabaya 11 tahun tidak keluar sertifikat SHMSRS, dan pengembang menunggak PBB 5 tahun. nilainya 7 Milyaran. Apakah yang akan bapak lakukan sebagai pejabat wakil walikota SURABAYA yang sedang punya kuasa? Apakah pengembang masih diberi ijin pemasaran kalau mereka tidak melunasi PBB bertahun tahun? Bagaimana mencegah masayarakat Surabaya supaya tidak menjadi korban apartemen bermasalah sulit  bisa AJB ? @bapendasurabaya @komisic_dprdsurabaya",2026-05-01T00:30:41.000Z,2026-06-06T05:28:17Z,Q_69ea7d16fb08,new,true
1ffdd5f7e78f46a65afe20ea61b4a76c0512394f7e2063c7d726d168f35dddce,18467644738103735,cdf7ee45ab1d13574779f4d702117bc990de4c113c5103660fb89a361909b852,https://www.instagram.com/p/DXtgXz2Ef_E/,DXtgXz2Ef_E,@cakj1,Saya juga mau melaporkan arma gemol jajar tunggal wiyung kasus penipuan lowongan kerja bayar admin outsourching dan pengelapan barang,2026-04-30T17:39:14.000Z,2026-06-06T05:28:17Z,Q_69ea7d16fb08,new,true
